-- phpMyAdmin SQL Dump
-- version 4.9.4
-- https://www.phpmyadmin.net/
--
-- Host: localhost:3306
-- Generation Time: Nov 07, 2020 at 07:27 AM
-- Server version: 10.3.24-MariaDB-log-cll-lve
-- PHP Version: 7.3.6

SET SQL_MODE = "NO_AUTO_VALUE_ON_ZERO";
SET AUTOCOMMIT = 0;
START TRANSACTION;
SET time_zone = "+00:00";


/*!40101 SET @OLD_CHARACTER_SET_CLIENT=@@CHARACTER_SET_CLIENT */;
/*!40101 SET @OLD_CHARACTER_SET_RESULTS=@@CHARACTER_SET_RESULTS */;
/*!40101 SET @OLD_COLLATION_CONNECTION=@@COLLATION_CONNECTION */;
/*!40101 SET NAMES utf8mb4 */;

--
-- Database: `sewatduu_sewacity`
--

-- --------------------------------------------------------

--
-- Table structure for table `cart_items`
--

CREATE TABLE `cart_items` (
  `id` bigint(20) UNSIGNED NOT NULL,
  `user_id` varchar(255) COLLATE utf8mb4_unicode_ci NOT NULL,
  `posts_id` varchar(255) COLLATE utf8mb4_unicode_ci NOT NULL,
  `quantity` float NOT NULL DEFAULT 0,
  `pname` varchar(255) COLLATE utf8mb4_unicode_ci NOT NULL,
  `price` varchar(255) COLLATE utf8mb4_unicode_ci NOT NULL,
  `created_at` timestamp NULL DEFAULT NULL,
  `updated_at` timestamp NULL DEFAULT NULL,
  `discount` float NOT NULL DEFAULT 0,
  `category` varchar(255) COLLATE utf8mb4_unicode_ci DEFAULT NULL
) ENGINE=InnoDB DEFAULT CHARSET=utf8mb4 COLLATE=utf8mb4_unicode_ci;

--
-- Dumping data for table `cart_items`
--

INSERT INTO `cart_items` (`id`, `user_id`, `posts_id`, `quantity`, `pname`, `price`, `created_at`, `updated_at`, `discount`, `category`) VALUES
(154, '49', '349', 1, 'Gas Lighter-----JKF', '175', '2020-06-12 19:45:23', '2020-06-12 19:45:23', 48.5, 'kitchen'),
(165, '119', '22', 1, 'Almirah with Drawer', '7300', '2020-06-19 07:07:02', '2020-06-19 07:07:02', 13.7, 'furniture'),
(168, '112', '429', 1, 'K-N95 Face Mask', '230', '2020-06-20 16:22:02', '2020-06-20 16:22:02', 56.96, 'Essentials'),
(176, '141', '429', 1, 'K-N95 Face Mask', '230', '2020-06-21 14:29:54', '2020-06-21 14:29:54', 56.96, 'Essentials'),
(267, '211', '506', 1, 'Amaze pudding set___UNA', '340', '2020-07-13 18:45:14', '2020-07-13 18:45:14', 39.2, 'Gift'),
(286, '195', '504', 1, 'Doll Set-charming fashion girl___UNA', '135', '2020-07-20 16:46:46', '2020-07-20 16:46:46', 33, 'Gift'),
(290, '38', '452', 1, 'Rakhi (XAE)', '36', '2020-07-23 10:24:53', '2020-07-23 10:24:53', 0, 'Festival'),
(305, '239', '485', 1, 'Amul Kool 250 ML:-JSM', '25', '2020-07-31 04:53:34', '2020-07-31 04:53:34', 8, 'Season'),
(307, '23', '700', 1, '50W helosion light', '100', '2020-07-31 16:31:04', '2020-07-31 16:31:04', 0, 'Elecpart'),
(309, '23', '425', 1, '\"Assure SHAVING CREAM \"-HUH', '120', '2020-07-31 21:47:58', '2020-07-31 21:47:58', 10, 'Cosmetic'),
(313, '23', '442', 1, 'Lumba Rakhi 1 (XAE)', '25', '2020-08-01 21:48:53', '2020-08-01 21:48:53', 0, 'Festival'),
(314, '243', '483', 1, 'Bislery 1L:-JSM', '18', '2020-08-02 11:32:39', '2020-08-02 11:32:39', 16.67, 'Season'),
(315, '243', '480', 1, 'Sprite 2.2L :-JSM', '95', '2020-08-02 11:33:05', '2020-08-02 11:33:05', 5.26, 'Season'),
(320, '23', '346', 1, '18×18 big bhatti------JKF', '2000', '2020-08-06 14:17:06', '2020-08-06 14:17:06', 2.5, 'kitchen'),
(322, '253', '208', 1, 'Pradeep\'s A Text Book of Biology for Class 11 ITH', '1300', '2020-08-09 11:55:26', '2020-08-09 11:55:26', 10, 'Books'),
(323, '91', '540', 1, 'Livon hair serum-ATK', '65', '2020-08-13 08:07:24', '2020-08-13 08:07:24', 6, 'Cosmetic'),
(324, '261', '484', 1, 'Coolberg Beer (Non Alcoholic) 330ML, Buy 6 get 1 free :-JSM', '69', '2020-08-13 19:28:11', '2020-08-13 19:28:11', 0, 'Season'),
(327, '23', '666', 1, 'Ncert Chemistry Part-1 For Class 11th--------ITH', '155', '2020-08-17 02:23:50', '2020-08-17 02:23:50', 0, 'Books'),
(328, '23', '636', 1, 'Chemistry for class 12th part:-2', '115', '2020-08-17 02:24:39', '2020-08-17 02:24:39', 0, 'Books'),
(329, '274', '482', 1, 'Appy Fizze 250ML:-JSM', '15', '2020-08-18 16:01:09', '2020-08-18 16:01:09', 0, 'Season'),
(330, '278', '700', 1, '50W helosion light', '100', '2020-08-18 21:58:53', '2020-08-18 21:58:53', 0, 'Elecpart'),
(333, '293', '484', 1, 'Coolberg Beer (Non Alcoholic) 330ML, Buy 6 get 1 free :-JSM', '69', '2020-08-21 19:14:51', '2020-08-21 19:14:51', 0, 'Season'),
(335, '331', '365', 1, 'SURAKSHA LPG Hose Pipe--------------JKF', '190', '2020-08-29 02:32:56', '2020-08-29 02:32:56', 21.05, 'kitchen'),
(339, '243', '701', 1, '6A JPS Extension cord', '240', '2020-08-30 16:32:57', '2020-08-30 16:32:57', 20.83, 'Elecpart'),
(343, '362', '356', 1, 'Aalishan supreme sonam rice ------------------------- KTU', '1050', '2020-09-03 18:51:59', '2020-09-03 18:51:59', 4.76, NULL),
(348, '23', '694', 1, 'NCERT Science class:-7 ITH', '50', '2020-09-14 16:26:12', '2020-09-14 16:26:12', 0, NULL),
(350, '40', '708', 1, 'ALL IN ONE MATHS, Arihant 9th (IHT)', '450', '2020-09-20 22:05:53', '2020-09-20 22:05:53', 20, NULL),
(355, '404', '425', 1, '\"Assure SHAVING CREAM \"-HUH', '120', '2020-09-24 16:29:54', '2020-09-24 16:29:54', 10, NULL),
(362, '411', '509', 1, 'Love gift-Gift for love___UNA', '120', '2020-09-26 17:25:08', '2020-09-26 17:25:08', 42, NULL),
(363, '411', '484', 1, 'Coolberg Beer (Non Alcoholic) 330ML, Buy 6 get 1 free :-JSM', '69', '2020-09-26 17:41:34', '2020-09-26 17:41:34', 0, NULL),
(365, '416', '425', 1, '\"Assure SHAVING CREAM \"-HUH', '120', '2020-09-29 04:28:47', '2020-09-29 04:28:47', 10, NULL),
(366, '407', '930', 1, 'Haldiram bhelpuri (AWM )', '42', '2020-09-30 21:55:30', '2020-09-30 21:55:30', 7, NULL),
(367, '407', '288', 1, 'HairX Advanced Care Ultimate Repair  Nourishing Conditioner(XAE)', '459', '2020-09-30 21:55:48', '2020-09-30 21:55:48', 17.43, NULL),
(368, '424', '483', 1, 'Bislery 1L:-JSM', '18', '2020-10-01 00:51:39', '2020-10-01 00:51:39', 16.67, NULL),
(371, '439', '987', 1, 'Cadbury bournvita lil champs', '283', '2020-10-03 15:36:06', '2020-10-03 15:36:06', 5, NULL),
(372, '441', '970', 1, 'Aashirvad Salt', '15', '2020-10-03 15:59:33', '2020-10-03 15:59:33', 0, NULL),
(373, '440', '484', 1, 'Coolberg Beer (Non Alcoholic) 330ML, Buy 6 get 1 free :-JSM', '69', '2020-10-03 16:15:30', '2020-10-03 16:15:30', 0, NULL),
(376, '436', '625', 1, 'Maxx deododant-30ml spray RTU', '165', '2020-10-03 16:39:29', '2020-10-03 16:39:29', 25, NULL),
(377, '443', '627', 1, 'Accounts for class 11 ITH', '125', '2020-10-03 16:48:49', '2020-10-03 16:48:49', 0, NULL),
(396, '460', '626', 1, 'maxx deodorant-100ml spray RTU', '575', '2020-10-04 17:41:37', '2020-10-04 17:41:37', 25, NULL),
(399, '481', '1000', 1, 'Bisk-farm half half(Awm)', '10', '2020-10-06 16:51:48', '2020-10-06 16:51:48', 5, NULL),
(402, '330', '1078', 1, 'A A A Papad (PRB)', '30', '2020-10-07 21:21:24', '2020-10-07 21:21:24', 25, NULL),
(403, '484', '1078', 1, 'A A A Papad (PRB)', '30', '2020-10-08 03:55:16', '2020-10-08 03:55:16', 25, NULL),
(404, '439', '1028', 1, 'Chini (AWM)', '38', '2020-10-08 21:44:15', '2020-10-08 21:44:15', 0, NULL),
(405, '481', '1004', 1, 'Britania cake fruit fun (Awm)', '30', '2020-10-09 04:29:40', '2020-10-09 04:29:40', 5, NULL),
(406, '481', '1039', 1, 'Bikano navratan mixture', '48', '2020-10-10 01:33:06', '2020-10-10 01:33:06', 16.67, NULL),
(412, '465', '484', 1, 'Coolberg Beer (Non Alcoholic) 330ML, Buy 6 get 1 free :-JSM', '69', '2020-10-14 16:39:53', '2020-10-14 16:39:53', 0, NULL),
(413, '481', '817', 1, 'mi super bass wireless headphone (BUN)', '2199', '2020-10-14 21:35:53', '2020-10-14 21:35:53', 18.19, NULL),
(414, '481', '835', 1, 'Mi buisness backpack (BUN)', '1499', '2020-10-14 21:36:02', '2020-10-14 21:36:02', 13.34, NULL),
(417, '537', '1036', 1, 'Bikano rasgulla', '210', '2020-10-17 15:25:35', '2020-10-17 15:25:35', 9.52, NULL),
(418, '545', '1055', 1, 'Aashirvaad Atta (PRB)', '205', '2020-10-17 22:32:30', '2020-10-17 22:32:30', 17.07, NULL),
(419, '549', '1115', 1, 'Horlicks (PRB)', '242', '2020-10-19 15:18:59', '2020-10-19 15:18:59', 26.86, NULL),
(420, '462', '484', 1, 'Coolberg Beer (Non Alcoholic) 330ML, Buy 6 get 1 free :-JSM', '69', '2020-10-20 20:39:52', '2020-10-20 20:39:52', 0, NULL),
(421, '87', '491', 1, 'Nivea deodorant spray____ATK', '199', '2020-10-26 21:53:57', '2020-10-26 21:53:57', 15, NULL),
(422, '586', '970', 1, 'Aashirvad Salt', '15', '2020-10-26 22:21:06', '2020-10-26 22:21:06', 0, NULL),
(434, '577', '978', 1, 'Aashirvad shudh chakki aata', '175', '2020-10-31 23:53:46', '2020-10-31 23:53:46', 0, NULL),
(435, '493', '1008', 1, 'Horlicks classic malt refill(Awm)', '428', '2020-11-01 21:03:51', '2020-11-01 21:03:51', 5, NULL),
(440, '614', '798', 1, 'CONA ORIGINAL QUICK GRIP ( TAPE ) 18mm×0.125×7m', '15', '2020-11-04 21:50:54', '2020-11-04 21:50:54', 30.05, NULL),
(441, '616', '1078', 1, 'A A A Papad (PRB)', '30', '2020-11-05 03:06:53', '2020-11-05 03:06:53', 25, NULL);

-- --------------------------------------------------------

--
-- Table structure for table `categories`
--

CREATE TABLE `categories` (
  `id` bigint(20) UNSIGNED NOT NULL,
  `category_name` varchar(255) COLLATE utf8mb4_unicode_ci NOT NULL,
  `city_id` int(11) NOT NULL,
  `created_at` timestamp NULL DEFAULT NULL,
  `updated_at` timestamp NULL DEFAULT NULL,
  `order` int(11) NOT NULL DEFAULT 0
) ENGINE=InnoDB DEFAULT CHARSET=utf8mb4 COLLATE=utf8mb4_unicode_ci;

--
-- Dumping data for table `categories`
--

INSERT INTO `categories` (`id`, `category_name`, `city_id`, `created_at`, `updated_at`, `order`) VALUES
(1, 'Electronic Appliances', 1, '2020-08-23 13:03:26', '2020-09-21 14:40:30', 8),
(2, 'Essential Products', 1, '2020-08-23 13:03:44', '2020-09-21 14:40:57', 16),
(3, 'Footwear', 1, '2020-08-23 13:05:48', '2020-09-21 14:41:08', 17),
(4, 'Books', 1, '2020-08-23 13:05:56', '2020-09-21 20:39:18', 24),
(5, 'Furniture', 1, '2020-08-23 13:06:54', '2020-09-21 14:41:26', 21),
(8, 'Cosmetics', 1, '2020-08-23 13:07:48', '2020-09-21 14:43:18', 13),
(9, 'Gift Item', 1, '2020-08-23 13:08:13', '2020-09-21 14:43:31', 19),
(10, 'Electrical Parts', 1, '2020-08-23 13:08:24', '2020-09-21 14:43:42', 12),
(11, 'Seasonal Items', 1, '2020-08-23 13:08:45', '2020-09-21 14:46:13', 20),
(12, 'Festival Items', 1, '2020-08-23 13:08:57', '2020-09-21 14:46:24', 18),
(13, 'Others', 1, '2020-08-23 13:09:06', '2020-09-21 20:38:49', 25),
(14, 'Electrical Appliances', 2, '2020-08-23 13:03:26', '2020-08-23 13:03:26', 1),
(15, 'Essential Products', 2, '2020-08-23 13:03:44', '2020-08-23 13:03:44', 2),
(16, 'Footwear', 2, '2020-08-23 13:05:48', '2020-08-23 13:05:48', 3),
(17, 'Books', 2, '2020-08-23 13:05:56', '2020-08-23 13:05:56', 4),
(18, 'Furniture', 2, '2020-08-23 13:06:54', '2020-08-23 13:06:54', 5),
(19, 'Kitchen Needs', 2, '2020-08-23 13:07:06', '2020-08-23 13:07:06', 6),
(20, 'Grocery', 2, '2020-08-23 13:07:32', '2020-08-23 13:07:32', 7),
(21, 'Cosmetics', 2, '2020-08-23 13:07:48', '2020-08-23 13:07:48', 8),
(22, 'Gift Item', 2, '2020-08-23 13:08:13', '2020-08-23 13:08:13', 9),
(23, 'Electrical Parts', 2, '2020-08-23 13:08:24', '2020-08-23 13:08:24', 10),
(24, 'Seasonal Items', 2, '2020-08-23 13:08:45', '2020-08-23 13:08:45', 11),
(25, 'Festival Items', 2, '2020-08-23 13:08:57', '2020-08-23 13:08:57', 12),
(26, 'Others', 2, '2020-08-23 13:09:06', '2020-08-23 13:09:22', 13),
(31, 'Mobile Phones', 1, '2020-08-31 01:08:00', '2020-09-21 14:46:53', 7),
(32, 'Mobile accessories', 1, '2020-09-01 15:39:22', '2020-09-21 14:57:49', 5),
(33, 'MI  Product', 1, '2020-09-01 15:41:30', '2020-09-21 14:57:04', 1),
(34, 'NCERT', 1, '2020-09-01 15:42:17', '2020-09-21 14:47:24', 9),
(35, 'General Competition Books', 1, '2020-09-01 15:43:25', '2020-09-21 14:47:36', 11),
(36, 'Medical  And Engineering Book', 1, '2020-09-01 15:45:11', '2020-09-21 14:47:47', 10),
(37, 'Other Publications & Board Books', 1, '2020-09-01 15:58:56', '2020-09-21 14:47:59', 14),
(38, 'Spices(मसाला)', 1, '2020-09-21 14:44:22', '2020-09-21 14:44:22', 6),
(39, 'Biscuits & Snacks', 1, '2020-09-21 14:44:51', '2020-09-21 14:58:51', 3),
(40, 'Hygiene & Cleaning', 1, '2020-09-21 14:45:16', '2020-09-23 19:25:59', 5),
(41, 'Beverages & Drinks', 1, '2020-09-21 14:45:53', '2020-09-21 14:59:00', 4),
(43, 'Grocery', 1, '2020-09-21 15:54:21', '2020-09-21 15:54:21', 2),
(44, 'Rice', 1, '2020-09-21 17:54:35', '2020-09-21 17:54:35', 8),
(45, 'IMC Products', 1, '2020-09-21 20:14:14', '2020-09-21 20:39:25', 23),
(46, 'Vestige Products', 1, '2020-09-21 20:14:29', '2020-09-21 20:38:58', 22),
(47, 'Sweets & Snacks(Bikano)', 1, '2020-10-03 01:32:01', '2020-10-03 01:32:01', 9),
(48, 'Patanjali', 1, '2020-10-29 15:59:10', '2020-10-29 15:59:10', 1);

-- --------------------------------------------------------

--
-- Table structure for table `cities`
--

CREATE TABLE `cities` (
  `id` int(11) NOT NULL,
  `city_name` text DEFAULT NULL,
  `is_active` int(11) NOT NULL DEFAULT 1,
  `order` int(11) NOT NULL DEFAULT 1,
  `created_at` timestamp NULL DEFAULT NULL,
  `updated_at` timestamp NULL DEFAULT NULL
) ENGINE=MyISAM DEFAULT CHARSET=latin1;

--
-- Dumping data for table `cities`
--

INSERT INTO `cities` (`id`, `city_name`, `is_active`, `order`, `created_at`, `updated_at`) VALUES
(1, 'Forbesganj', 1, 1, NULL, NULL),
(2, 'Parbelia', 1, 1, NULL, '2020-10-06 03:52:34'),
(3, 'Durgapur', 1, 1, '2020-10-06 03:52:54', '2020-10-06 03:52:54'),
(4, 'Other', 1, 2, '2020-10-09 20:22:07', '2020-10-09 20:27:25'),
(5, 'Chandigarh', 1, 1, '2020-10-09 20:25:28', '2020-10-09 20:25:28'),
(6, 'Patna', 1, 1, '2020-10-15 02:51:04', '2020-10-15 02:52:08');

-- --------------------------------------------------------

--
-- Table structure for table `failed_jobs`
--

CREATE TABLE `failed_jobs` (
  `id` bigint(20) UNSIGNED NOT NULL,
  `connection` text COLLATE utf8mb4_unicode_ci NOT NULL,
  `queue` text COLLATE utf8mb4_unicode_ci NOT NULL,
  `payload` longtext COLLATE utf8mb4_unicode_ci NOT NULL,
  `exception` longtext COLLATE utf8mb4_unicode_ci NOT NULL,
  `failed_at` timestamp NOT NULL DEFAULT current_timestamp()
) ENGINE=InnoDB DEFAULT CHARSET=utf8mb4 COLLATE=utf8mb4_unicode_ci;

-- --------------------------------------------------------

--
-- Table structure for table `feedbacks`
--

CREATE TABLE `feedbacks` (
  `id` bigint(20) UNSIGNED NOT NULL,
  `name` text COLLATE utf8mb4_unicode_ci NOT NULL,
  `experience` text COLLATE utf8mb4_unicode_ci NOT NULL,
  `comments` mediumtext COLLATE utf8mb4_unicode_ci NOT NULL,
  `email` varchar(255) COLLATE utf8mb4_unicode_ci NOT NULL,
  `email_verified_at` timestamp NULL DEFAULT NULL,
  `is_approved` int(11) NOT NULL DEFAULT 0,
  `created_at` timestamp NULL DEFAULT NULL,
  `updated_at` timestamp NULL DEFAULT NULL
) ENGINE=InnoDB DEFAULT CHARSET=utf8mb4 COLLATE=utf8mb4_unicode_ci;

--
-- Dumping data for table `feedbacks`
--

INSERT INTO `feedbacks` (`id`, `name`, `experience`, `comments`, `email`, `email_verified_at`, `is_approved`, `created_at`, `updated_at`) VALUES
(6, 'Pardeep Choubey', 'Good', '<p>Sewacity is like a blessing on this city Forbesganj. It came up to help when it was really necessary and took the risk in this pandemic to make our life easier. Thank you so much. It&#39;s time we give back to Sewacity the name and recognition it needs.&nbsp;&nbsp;</p>', 'amulyasrsvm25@gmail.com', NULL, 0, '2020-08-20 18:47:43', '2020-11-04 14:05:21'),
(9, 'Raj kumar', 'Good', '<p>Momo khaye the.... Ek number tha ❤❤👍👍</p>', 'rajunadan@gmail.com', NULL, 1, '2020-08-21 02:25:31', '2020-08-21 02:25:49'),
(10, 'Ashwini Kumar', 'Good', '<p>Good... But improvement required.&nbsp;</p>', 'ashurock205@gmail.com', NULL, 1, '2020-08-22 21:27:46', '2020-11-04 14:05:44'),
(12, 'Payal Gupta', 'Good', '<p>Today i ordered momo from sewacity...the momo was really tasty.</p>', 'pg9006369171@gmail.com', NULL, 1, '2020-08-24 01:08:33', '2020-08-24 12:52:38'),
(14, 'Harsh', 'Good', '<p>Very good service and fresh product.&nbsp;</p>\r\n\r\n<p>I am totally satisfied with sewacity.&nbsp;</p>', 'harshpankajfbg@gmail.com', NULL, 1, '2020-08-26 20:35:33', '2020-08-27 04:12:49'),
(15, 'Farzana Iqubal', 'Good', '<p>Momo chowmin manchurian sab bahut bht yummmm the thank you sewacity 👌👌😋😋😊</p>', 'farzuiqubal98@gmail.com', NULL, 1, '2020-08-26 23:30:40', '2020-08-27 04:13:13'),
(17, 'Priya', 'Good', '<p>Superb</p>', 'deopriyanidhi@gmail.com', NULL, 1, '2020-09-05 18:47:29', '2020-09-05 21:57:03'),
(18, 'Joe Meese', 'Bad', 'Hello,\r\n\r\nPPE stock we can ship today from Los Angeles, CA. You can also send someone to inspect the stock or pick it up from Beverly Hills California.\r\n\r\n* Nitrile Gloves\r\n* KN95 (CDC EUI List FDA approved)\r\n* KN95 (FDA approved)\r\n* 3Ply Disposable Masks (Level 1, 2, 3 - Medical grade)\r\n* Contactless Thermometer\r\n* Hand Sanitizers\r\n\r\nFor production run:\r\n* Isolation Gowns\r\n* Disposable Shoe Cover\r\n* Disposable Head Cover\r\n* Rapid Antibody Test Kits (FOB China)\r\n* Cotton Masks\r\n\r\nLet me know if we can get on a call, you can call us directly on 310 596 5555.\r\n\r\nWe are FDA approved company (FDA number 3016649392) and PPAI.\r\n\r\nThanks and stay safe,\r\nJoe Meese\r\n310 596 5555\r\nppekits.net\r\nPPE Kits by Dioz Group of Companies, Beverly Hills CA (PPAI/ FDA)\r\n\r\n\r\nRegards,\r\n\r\n— \r\n\r\nJoe Meese | Director of Marketing\r\nDioz Group | Oasis Apparel | Alanic | PPE KITS | Clean Health USA\r\nHQ: Beverly Hills, CA 90211, USA\r\nW: www.diozgroup.com\r\nW: https://cleanhealthusa.com', 'joemeese@diozgroup.online', NULL, 0, '2020-09-11 14:50:21', '2020-09-11 14:50:21'),
(19, 'Vijay Jain', 'Good', '<p>You can order fresh groceries directly to your door without leaving Your home . I am completely satisfied with all the services.&nbsp;</p>', 'hemanjain11559@gmail.com', NULL, 1, '2020-09-11 21:24:27', '2020-09-12 02:23:52'),
(21, 'simran singh', 'Good', '<p>This is nice ..</p>\r\n\r\n<p>They r doing their jobs in the best way&nbsp;</p>\r\n\r\n<p>thank you&nbsp;</p>', 'simransingh65409@gmail.com', NULL, 1, '2020-09-28 16:34:20', '2020-09-28 16:41:06'),
(22, 'Eric Jones', 'Bad', 'Hey, my name’s Eric and for just a second, imagine this…\r\n\r\n- Someone does a search and winds up at sewacity.com.\r\n\r\n- They hang out for a minute to check it out.  “I’m interested… but… maybe…”\r\n\r\n- And then they hit the back button and check out the other search results instead. \r\n\r\n- Bottom line – you got an eyeball, but nothing else to show for it.\r\n\r\n- There they go.\r\n\r\nThis isn’t really your fault – it happens a LOT – studies show 7 out of 10 visitors to any site disappear without leaving a trace.\r\n\r\nBut you CAN fix that.\r\n\r\nTalk With Web Visitor is a software widget that’s works on your site, ready to capture any visitor’s Name, Email address and Phone Number.  It lets you know right then and there – enabling you to call that lead while they’re literally looking over your site.\r\n\r\nCLICK HERE http://www.talkwithwebvisitors.com to try out a Live Demo with Talk With Web Visitor now to see exactly how it works.\r\n\r\nTime is money when it comes to connecting with leads – the difference between contacting someone within 5 minutes versus 30 minutes later can be huge – like 100 times better!\r\n\r\nPlus, now that you have their phone number, with our new SMS Text With Lead feature you can automatically start a text (SMS) conversation… so even if you don’t close a deal then, you can follow up with text messages for new offers, content links, even just “how you doing?” notes to build a relationship.\r\n\r\nStrong stuff.\r\n\r\nCLICK HERE http://www.talkwithwebvisitors.com to discover what Talk With Web Visitor can do for your business.\r\n\r\nYou could be converting up to 100X more leads today!\r\n\r\nEric\r\nPS: Talk With Web Visitor offers a FREE 14 days trial – and it even includes International Long Distance Calling. \r\nYou have customers waiting to talk with you right now… don’t keep them waiting. \r\nCLICK HERE http://www.talkwithwebvisitors.com to try Talk With Web Visitor now.\r\n\r\nIf you\'d like to unsubscribe click here http://talkwithwebvisitors.com/unsubscribe.aspx?d=sewacity.com', 'eric@talkwithwebvisitor.com', NULL, 0, '2020-09-29 14:37:45', '2020-09-29 14:37:45'),
(23, 'Bulbul keshri', 'Good', '<p>Very nice food</p>', 'bulbulfbg1@gmail.com', NULL, 1, '2020-10-02 23:15:33', '2020-10-03 01:17:27'),
(24, 'Rijusha Ranjan', 'Good', '<p>Impressive... service ❤️❤️with&nbsp; perfect punctuality ❤️❤️..</p>', 'rijusharanjan@gmail.com', NULL, 0, '2020-10-10 15:24:18', '2020-10-10 15:24:18'),
(25, 'Rijusha Ranjan', 'Good', '<p>Lovely..manner👍🏻..respectful response..with satisfied service 👍🏻👍🏻</p>', 'rijusharanjan@gmail.com', NULL, 1, '2020-10-10 15:26:23', '2020-10-10 15:55:26'),
(26, 'Eric Jones', 'Bad', 'Hey, this is Eric and I ran across sewacity.com a few minutes ago.\r\n\r\nLooks great… but now what?\r\n\r\nBy that I mean, when someone like me finds your website – either through Search or just bouncing around – what happens next?  Do you get a lot of leads from your site, or at least enough to make you happy?\r\n\r\nHonestly, most business websites fall a bit short when it comes to generating paying customers. Studies show that 70% of a site’s visitors disappear and are gone forever after just a moment.\r\n\r\nHere’s an idea…\r\n \r\nHow about making it really EASY for every visitor who shows up to get a personal phone call you as soon as they hit your site…\r\n \r\nYou can –\r\n  \r\nTalk With Web Visitor is a software widget that’s works on your site, ready to capture any visitor’s Name, Email address and Phone Number.  It signals you the moment they let you know they’re interested – so that you can talk to that lead while they’re literally looking over your site.\r\n\r\nCLICK HERE http://www.talkwithwebvisitors.com to try out a Live Demo with Talk With Web Visitor now to see exactly how it works.\r\n\r\nYou’ll be amazed - the difference between contacting someone within 5 minutes versus a half-hour or more later could increase your results 100-fold.\r\n\r\nIt gets even better… once you’ve captured their phone number, with our new SMS Text With Lead feature, you can automatically start a text (SMS) conversation.\r\n  \r\nThat way, even if you don’t close a deal right away, you can follow up with text messages for new offers, content links, even just “how you doing?” notes to build a relationship.\r\n\r\nPretty sweet – AND effective.\r\n\r\nCLICK HERE http://www.talkwithwebvisitors.com to discover what Talk With Web Visitor can do for your business.\r\n\r\nYou could be converting up to 100X more leads today!\r\n\r\nEric\r\nPS: Talk With Web Visitor offers a FREE 14 days trial – and it even includes International Long Distance Calling. \r\nYou have customers waiting to talk with you right now… don’t keep them waiting. \r\nCLICK HERE http://www.talkwithwebvisitors.com to try Talk With Web Visitor now.\r\n\r\nIf you\'d like to unsubscribe click here http://talkwithwebvisitors.com/unsubscribe.aspx?d=sewacity.com', 'eric@talkwithwebvisitor.com', NULL, 0, '2020-10-12 08:11:53', '2020-10-12 08:11:53'),
(27, 'Chance Ma', 'Bad', 'ATT: sewacity.com / Home Page  WEB SITE SOLUTIONS\r\nThis notice RUNS OUT ON: Oct 13, 2020\r\n\r\n\r\nWe have actually not obtained a settlement from you.\r\nWe\'ve attempted to contact you however were incapable to contact you.\r\n\r\n\r\nKindly Go To: https://bit.ly/34TSQol .\r\n\r\nFor info as well as to process a optional payment for services.\r\n\r\n\r\n\r\n10132020214712.', 'information@sewacity.com', NULL, 0, '2020-10-14 11:29:12', '2020-10-14 11:29:12'),
(28, 'Akash kumar', 'Good', '<p>Awesome service , i had to change my delivery time many times, but they were awesome they gave importance to my every request .&nbsp;</p>\r\n\r\n<p>Talking about the quality then i must say they are way better than there competitors,&nbsp;</p>\r\n\r\n<p>Try once and this will become your default choice...,!,</p>', 'akashk620585@gmail.com', NULL, 1, '2020-10-17 15:23:50', '2020-10-17 15:27:06'),
(29, 'Akash', 'Good', '<p>Tasty Food... Everyone must try once.. the service is awsm.&nbsp;</p>', 'akashbcroy@gmail.com', NULL, 1, '2020-10-17 22:50:39', '2020-10-19 19:19:19'),
(30, 'Eric Jones', 'Bad', 'Hey, my name’s Eric and for just a second, imagine this…\r\n\r\n- Someone does a search and winds up at sewacity.com.\r\n\r\n- They hang out for a minute to check it out.  “I’m interested… but… maybe…”\r\n\r\n- And then they hit the back button and check out the other search results instead. \r\n\r\n- Bottom line – you got an eyeball, but nothing else to show for it.\r\n\r\n- There they go.\r\n\r\nThis isn’t really your fault – it happens a LOT – studies show 7 out of 10 visitors to any site disappear without leaving a trace.\r\n\r\nBut you CAN fix that.\r\n\r\nTalk With Web Traffic is a software widget that’s works on your site, ready to capture any visitor’s Name, Email address and Phone Number.  It lets you know right then and there – enabling you to call that lead while they’re literally looking over your site.\r\n\r\n==> https://www.talkwithwebtraffic.com to try out a Live Demo with Talk With Web Traffic now to see exactly how it works.\r\n\r\nTime is money when it comes to connecting with leads – the difference between contacting someone within 5 minutes versus 30 minutes later can be huge – like 100 times better!\r\n\r\nPlus, now that you have their phone number, with our new SMS Text With Lead feature you can automatically start a text (SMS) conversation… so even if you don’t close a deal then, you can follow up with text messages for new offers, content links, even just “how you doing?” notes to build a relationship.\r\n\r\nStrong stuff.\r\n\r\n==> https://www.talkwithwebtraffic.com to discover what Talk With Web Traffic can do for your business.\r\n\r\nYou could be converting up to 100X more leads today!\r\n\r\nEric\r\nPS: Talk With Web Traffic offers a FREE 14 days trial – and it even includes International Long Distance Calling. \r\nYou have customers waiting to talk with you right now… don’t keep them waiting. \r\n==> https://www.talkwithwebtraffic.com to try Talk With Web Traffic now.\r\n\r\nIf you\'d like to unsubscribe click here https://talkwithwebtraffic.com/unsubscribe.aspx?d=sewacity.com', 'eric@talkwithwebtraffic.com', NULL, 0, '2020-10-22 20:14:40', '2020-10-22 20:14:40'),
(31, 'Ambesh Jha', 'Good', '<p>The service you have given was very good. We are very happy that such good service is available in our city too।।।Thank you so Much......</p>', 'ambeshkumar264@gmail.com', NULL, 1, '2020-10-29 20:18:19', '2020-10-29 20:54:37'),
(32, 'Eric Jones', 'Bad', 'Hey there, I just found your site, quick question…\r\n\r\nMy name’s Eric, I found sewacity.com after doing a quick search – you showed up near the top of the rankings, so whatever you’re doing for SEO, looks like it’s working well.\r\n\r\nSo here’s my question – what happens AFTER someone lands on your site?  Anything?\r\n\r\nResearch tells us at least 70% of the people who find your site, after a quick once-over, they disappear… forever.\r\n\r\nThat means that all the work and effort you put into getting them to show up, goes down the tubes.\r\n\r\nWhy would you want all that good work – and the great site you’ve built – go to waste?\r\n\r\nBecause the odds are they’ll just skip over calling or even grabbing their phone, leaving you high and dry.\r\n\r\nBut here’s a thought… what if you could make it super-simple for someone to raise their hand, say, “okay, let’s talk” without requiring them to even pull their cell phone from their pocket?\r\n  \r\nYou can – thanks to revolutionary new software that can literally make that first call happen NOW.\r\n\r\nTalk With Web Visitor is a software widget that sits on your site, ready and waiting to capture any visitor’s Name, Email address and Phone Number.  It lets you know IMMEDIATELY – so that you can talk to that lead while they’re still there at your site.\r\n  \r\nYou know, strike when the iron’s hot!\r\n\r\nCLICK HERE http://www.talkwithwebvisitors.com to try out a Live Demo with Talk With Web Visitor now to see exactly how it works.\r\n\r\nWhen targeting leads, you HAVE to act fast – the difference between contacting someone within 5 minutes versus 30 minutes later is huge – like 100 times better!\r\n\r\nThat’s why you should check out our new SMS Text With Lead feature as well… once you’ve captured the phone number of the website visitor, you can automatically kick off a text message (SMS) conversation with them. \r\n \r\nImagine how powerful this could be – even if they don’t take you up on your offer immediately, you can stay in touch with them using text messages to make new offers, provide links to great content, and build your credibility.\r\n\r\nJust this alone could be a game changer to make your website even more effective.\r\n\r\nStrike when  the iron’s hot!\r\n\r\nCLICK HERE http://www.talkwithwebvisitors.com to learn more about everything Talk With Web Visitor can do for your business – you’ll be amazed.\r\n\r\nThanks and keep up the great work!\r\n\r\nEric\r\nPS: Talk With Web Visitor offers a FREE 14 days trial – you could be converting up to 100x more leads immediately!   \r\nIt even includes International Long Distance Calling. \r\nStop wasting money chasing eyeballs that don’t turn into paying customers. \r\nCLICK HERE http://www.talkwithwebvisitors.com to try Talk With Web Visitor now.\r\n\r\nIf you\'d like to unsubscribe click here http://talkwithwebvisitors.com/unsubscribe.aspx?d=sewacity.com', 'eric@talkwithwebvisitor.com', NULL, 0, '2020-11-06 02:48:07', '2020-11-06 02:48:07'),
(33, 'Eric Jones', 'Bad', 'Cool website!\r\n\r\nMy name’s Eric, and I just found your site - sewacity.com - while surfing the net. You showed up at the top of the search results, so I checked you out. Looks like what you’re doing is pretty cool.\r\n \r\nBut if you don’t mind me asking – after someone like me stumbles across sewacity.com, what usually happens?\r\n\r\nIs your site generating leads for your business? \r\n \r\nI’m guessing some, but I also bet you’d like more… studies show that 7 out 10 who land on a site wind up leaving without a trace.\r\n\r\nNot good.\r\n\r\nHere’s a thought – what if there was an easy way for every visitor to “raise their hand” to get a phone call from you INSTANTLY… the second they hit your site and said, “call me now.”\r\n\r\nYou can –\r\n  \r\nTalk With Web Visitor is a software widget that’s works on your site, ready to capture any visitor’s Name, Email address and Phone Number.  It lets you know IMMEDIATELY – so that you can talk to that lead while they’re literally looking over your site.\r\n\r\nCLICK HERE http://www.talkwithwebvisitors.com to try out a Live Demo with Talk With Web Visitor now to see exactly how it works.\r\n\r\nTime is money when it comes to connecting with leads – the difference between contacting someone within 5 minutes versus 30 minutes later can be huge – like 100 times better!\r\n\r\nThat’s why we built out our new SMS Text With Lead feature… because once you’ve captured the visitor’s phone number, you can automatically start a text message (SMS) conversation.\r\n  \r\nThink about the possibilities – even if you don’t close a deal then and there, you can follow up with text messages for new offers, content links, even just “how you doing?” notes to build a relationship.\r\n\r\nWouldn’t that be cool?\r\n\r\nCLICK HERE http://www.talkwithwebvisitors.com to discover what Talk With Web Visitor can do for your business.\r\n\r\nYou could be converting up to 100X more leads today!\r\nEric\r\n\r\nPS: Talk With Web Visitor offers a FREE 14 days trial – and it even includes International Long Distance Calling. \r\nYou have customers waiting to talk with you right now… don’t keep them waiting. \r\nCLICK HERE http://www.talkwithwebvisitors.com to try Talk With Web Visitor now.\r\n\r\nIf you\'d like to unsubscribe click here http://talkwithwebvisitors.com/unsubscribe.aspx?d=sewacity.com', 'ericjonesonline@outlook.com', NULL, 0, '2020-11-07 02:44:15', '2020-11-07 02:44:15');

-- --------------------------------------------------------

--
-- Table structure for table `food_carts`
--

CREATE TABLE `food_carts` (
  `id` bigint(20) UNSIGNED NOT NULL,
  `user_id` int(11) NOT NULL,
  `res_id` bigint(20) UNSIGNED NOT NULL,
  `food_id` bigint(20) UNSIGNED NOT NULL,
  `quantity` int(11) NOT NULL DEFAULT 0,
  `created_at` timestamp NULL DEFAULT NULL,
  `updated_at` timestamp NULL DEFAULT NULL
) ENGINE=InnoDB DEFAULT CHARSET=utf8mb4 COLLATE=utf8mb4_unicode_ci;

--
-- Dumping data for table `food_carts`
--

INSERT INTO `food_carts` (`id`, `user_id`, `res_id`, `food_id`, `quantity`, `created_at`, `updated_at`) VALUES
(47, 416, 18, 103, 1, '2020-09-29 04:25:10', '2020-09-29 04:25:10'),
(53, 158, 16, 67, 1, '2020-09-29 18:56:30', '2020-09-29 18:56:30'),
(54, 288, 14, 26, 1, '2020-09-29 20:24:06', '2020-09-29 20:24:06'),
(55, 288, 14, 28, 1, '2020-09-29 20:24:13', '2020-09-29 20:24:13'),
(125, 450, 16, 29, 1, '2020-10-04 00:31:07', '2020-10-04 00:31:07'),
(130, 456, 20, 132, 1, '2020-10-04 13:33:18', '2020-10-04 13:33:18'),
(141, 461, 19, 102, 1, '2020-10-04 22:56:26', '2020-10-04 22:56:40'),
(160, 471, 15, 19, 1, '2020-10-05 21:05:00', '2020-10-05 21:05:00'),
(185, 476, 16, 29, 1, '2020-10-06 22:38:21', '2020-10-06 22:38:21'),
(194, 411, 14, 14, 1, '2020-10-07 18:22:12', '2020-10-07 18:22:12'),
(195, 411, 14, 14, 1, '2020-10-07 18:22:16', '2020-10-07 18:22:16'),
(196, 411, 14, 13, 1, '2020-10-07 18:22:22', '2020-10-07 18:22:22'),
(200, 490, 19, 104, 3, '2020-10-07 20:29:16', '2020-10-07 20:29:19'),
(201, 461, 19, 96, 1, '2020-10-07 21:58:27', '2020-10-07 21:58:27'),
(207, 173, 16, 29, 1, '2020-10-08 21:12:29', '2020-10-08 21:12:29'),
(224, 501, 20, 139, 1, '2020-10-10 00:18:20', '2020-10-10 00:18:20'),
(236, 504, 16, 29, 1, '2020-10-10 22:06:27', '2020-10-10 22:06:36'),
(239, 509, 16, 71, 1, '2020-10-11 20:12:58', '2020-10-11 20:12:58'),
(258, 516, 19, 95, 1, '2020-10-13 22:10:59', '2020-10-13 22:10:59'),
(266, 288, 14, 58, 1, '2020-10-14 17:24:45', '2020-10-14 17:24:45'),
(283, 148, 15, 114, 1, '2020-10-15 20:44:12', '2020-10-15 20:44:12'),
(289, 532, 16, 29, 1, '2020-10-16 18:44:03', '2020-10-16 18:44:03'),
(290, 532, 16, 32, 1, '2020-10-16 18:44:16', '2020-10-16 18:44:16'),
(292, 420, 20, 137, 1, '2020-10-16 20:59:02', '2020-10-16 20:59:02'),
(296, 534, 14, 14, 1, '2020-10-16 23:01:55', '2020-10-16 23:01:55'),
(305, 330, 23, 185, 1, '2020-10-17 14:26:22', '2020-10-17 14:26:22'),
(307, 540, 23, 189, 2, '2020-10-17 17:54:03', '2020-10-17 17:54:15'),
(317, 546, 29, 247, 1, '2020-10-17 23:24:46', '2020-10-17 23:24:46'),
(319, 481, 29, 244, 1, '2020-10-18 16:10:48', '2020-10-18 16:10:48'),
(322, 550, 18, 108, 1, '2020-10-19 00:05:30', '2020-10-19 00:05:30'),
(340, 560, 29, 243, 1, '2020-10-22 14:28:34', '2020-10-22 14:28:34'),
(341, 119, 16, 71, 1, '2020-10-22 17:25:46', '2020-10-22 17:25:46'),
(345, 564, 29, 243, 1, '2020-10-23 00:40:03', '2020-10-23 00:40:03'),
(348, 570, 23, 185, 1, '2020-10-24 01:36:12', '2020-10-24 01:36:12'),
(396, 579, 27, 219, 1, '2020-10-26 00:01:03', '2020-10-26 00:01:03'),
(398, 584, 19, 96, 1, '2020-10-26 18:23:24', '2020-10-26 18:23:24'),
(399, 578, 29, 245, 5, '2020-10-26 21:11:04', '2020-10-26 21:11:10'),
(400, 578, 29, 243, 1, '2020-10-26 21:11:23', '2020-10-26 21:11:23'),
(402, 54, 20, 126, 1, '2020-10-26 22:56:27', '2020-10-26 22:56:27'),
(404, 589, 20, 131, 1, '2020-10-27 20:48:00', '2020-10-27 20:48:00'),
(409, 590, 24, 236, 1, '2020-10-27 23:09:52', '2020-10-27 23:09:52'),
(412, 578, 29, 244, 1, '2020-10-28 20:41:07', '2020-10-28 20:41:49'),
(422, 12, 14, 13, 1, '2020-10-29 20:48:02', '2020-10-29 20:48:02'),
(432, 493, 30, 249, 1, '2020-10-30 14:08:21', '2020-10-30 14:08:21'),
(447, 601, 23, 185, 2, '2020-10-31 00:19:20', '2020-10-31 00:19:25'),
(449, 603, 30, 249, 1, '2020-10-31 22:21:26', '2020-10-31 22:21:26'),
(458, 606, 25, 203, 2, '2020-11-01 22:27:27', '2020-11-01 22:27:30'),
(483, 572, 19, 102, 1, '2020-11-03 18:03:16', '2020-11-03 18:03:16'),
(488, 559, 29, 245, 2, '2020-11-03 23:39:41', '2020-11-03 23:39:43'),
(489, 614, 20, 147, 1, '2020-11-04 21:52:18', '2020-11-04 21:52:18'),
(491, 615, 29, 245, 1, '2020-11-04 22:00:40', '2020-11-04 22:00:55'),
(492, 615, 29, 252, 1, '2020-11-04 22:01:33', '2020-11-04 22:01:33'),
(512, 440, 16, 69, 1, '2020-11-06 14:11:15', '2020-11-06 14:11:15'),
(513, 572, 19, 100, 1, '2020-11-06 18:32:06', '2020-11-06 18:32:06'),
(519, 283, 30, 249, 1, '2020-11-07 14:32:28', '2020-11-07 14:33:28');

-- --------------------------------------------------------

--
-- Table structure for table `hotels`
--

CREATE TABLE `hotels` (
  `id` int(11) NOT NULL,
  `hotel_name` varchar(255) NOT NULL,
  `hotel_description` longtext NOT NULL,
  `hotel_image` varchar(255) NOT NULL,
  `hotel_reception_image` varchar(255) NOT NULL,
  `is_active` int(11) NOT NULL DEFAULT 1,
  `city_id` int(11) NOT NULL DEFAULT 1
) ENGINE=MyISAM DEFAULT CHARSET=latin1;

--
-- Dumping data for table `hotels`
--

INSERT INTO `hotels` (`id`, `hotel_name`, `hotel_description`, `hotel_image`, `hotel_reception_image`, `is_active`, `city_id`) VALUES
(1, 'Hotel Aditya', 'Hotel Aditya International, located in a privileged area of Chhuapatti in Forbesganj city, offers ultimate comfort and luxury. This 2015 established 3-storied hotel is a beautiful combination of traditional grandeur and modern facilities. The large conference room and 22 exclusive guest rooms are furnished with a range of modern amenities such as television, AC and internet access. The hotel has it\'s own restaurant Lazeez which offers local, national and international cuisines. The hotel is inviting, modern and cozy, with great staff, comfortable beds and functional bathrooms, everything you need for a pleasant stay.', 'food-1.jpg', 'adi.jpg', 1, 1);

-- --------------------------------------------------------

--
-- Table structure for table `hotel_bookings`
--

CREATE TABLE `hotel_bookings` (
  `id` int(11) NOT NULL,
  `name` varchar(255) DEFAULT NULL,
  `phone` varchar(255) DEFAULT NULL,
  `email` varchar(255) DEFAULT NULL,
  `checkin_date` text DEFAULT NULL,
  `checkout_date` text DEFAULT NULL,
  `no_of_adults` text NOT NULL DEFAULT '1',
  `no_of_children` text NOT NULL DEFAULT '0',
  `updated_at` timestamp NOT NULL DEFAULT current_timestamp(),
  `created_at` timestamp NOT NULL DEFAULT current_timestamp(),
  `Notes` varchar(255) DEFAULT NULL,
  `room_id` int(11) DEFAULT NULL,
  `booking_id` text DEFAULT NULL,
  `is_corporate` int(11) DEFAULT 0
) ENGINE=MyISAM DEFAULT CHARSET=latin1;

--
-- Dumping data for table `hotel_bookings`
--

INSERT INTO `hotel_bookings` (`id`, `name`, `phone`, `email`, `checkin_date`, `checkout_date`, `no_of_adults`, `no_of_children`, `updated_at`, `created_at`, `Notes`, `room_id`, `booking_id`, `is_corporate`) VALUES
(1, 'Gaurav Kumar', '123456789', 'gaurav.jss.027@gmail.com', '12 July, 2020', '12 July, 2020', '1', '0', '2020-07-19 10:58:53', '2020-07-19 10:58:53', 'jkladwjaljkdjlakwjkljd', 2, 'Hotel11595141933', 0),
(2, 'mayank', '8676036607', 'gupta656mayank@gmail.com', '22 July, 2020', '28 July, 2020', '2', '0', '2020-07-19 11:28:56', '2020-07-19 11:28:56', 'jgfgrhkj', 5, 'Hotel1-1595143736', 0),
(3, 'Gaurav Kumar', '1234567890', 'gaurav.jss.027@gmail.com', '15 July, 2020', '19 July, 2020', '1', '0', '2020-07-19 12:53:16', '2020-07-19 12:53:16', 'JKLJ', 4, 'Hotel1-1595148796', 1),
(4, 'Mayank', '9876543210', 'Mayankji@gmail.com', '6 August, 2020', '7 August, 2020', '2', '0', '2020-07-20 05:32:09', '2020-07-20 05:32:09', 'I Would like to reserve a room for night', 2, 'Hotel1-1595208729', 0),
(5, 'rohan', '8676036607', 'gupta656mayank@gmail.com', '22 July, 2020', '27 July, 2020', '2', '0', '2020-07-20 18:07:53', '2020-07-20 18:07:53', 'CALL ME', 4, 'Hotel1-1595254073', 1),
(6, 'nitish', '8676036607', 'gupta656mayank@gmail.com', '22 July, 2020', '23 July, 2020', '1', '0', '2020-07-20 21:09:20', '2020-07-20 21:09:20', 'call me', 1, 'Hotel1-1595264960', 0);

-- --------------------------------------------------------

--
-- Table structure for table `menus`
--

CREATE TABLE `menus` (
  `id` bigint(20) UNSIGNED NOT NULL,
  `name` varchar(255) COLLATE utf8mb4_unicode_ci NOT NULL,
  `price` double(8,2) NOT NULL,
  `image` varchar(255) COLLATE utf8mb4_unicode_ci NOT NULL,
  `desc` varchar(255) COLLATE utf8mb4_unicode_ci NOT NULL,
  `res_id` bigint(20) UNSIGNED NOT NULL,
  `created_at` timestamp NULL DEFAULT NULL,
  `updated_at` timestamp NULL DEFAULT NULL,
  `is_veg` int(11) DEFAULT NULL
) ENGINE=InnoDB DEFAULT CHARSET=utf8mb4 COLLATE=utf8mb4_unicode_ci;

--
-- Dumping data for table `menus`
--

INSERT INTO `menus` (`id`, `name`, `price`, `image`, `desc`, `res_id`, `created_at`, `updated_at`, `is_veg`) VALUES
(13, 'Mutton Handi', 300.00, '26-09-20_1601097418.jpeg', '3 Pieces( Mutton)', 14, '2020-09-26 14:46:58', '2020-09-30 12:12:39', 0),
(14, 'Chicken Butter Masala', 250.00, '26-09-20_1601097687.jpeg', '3 Pieces (Chicken)', 14, '2020-09-26 14:51:27', '2020-09-30 12:12:48', 0),
(15, 'Chocolate cake (A14 )', 350.00, '26-09-20_1601115338.webp', 'Quantity - 1 pound', 15, '2020-09-26 17:45:35', '2020-09-30 22:07:04', 1),
(17, 'Red valvet cake', 500.00, '26-09-20_1601115361.webp', 'Quantity - 1 pound', 15, '2020-09-26 17:47:31', '2020-09-30 22:07:10', 1),
(18, 'Chocolate cake (A93)', 350.00, '26-09-20_1601115381.webp', 'Quantity - 1 pound', 15, '2020-09-26 17:48:18', '2020-09-30 22:07:15', 1),
(19, 'Doll Cake (vanila flavour)', 1200.00, '26-09-20_1601115405.webp', 'Quantity - 4 pound', 15, '2020-09-26 17:57:21', '2020-09-30 22:07:20', 1),
(20, 'Mutton Butter Masala', 300.00, '26-09-20_1601108924.webp', '3 Pieces( Mutton)', 14, '2020-09-26 17:58:44', '2020-09-30 12:12:55', 0),
(21, 'Dorimon chocolate cake (A117)', 350.00, '26-09-20_1601115433.webp', 'Quantity - 1 pound', 15, '2020-09-26 17:58:47', '2020-09-30 22:07:26', 1),
(22, 'Mutton Masala', 300.00, '26-09-20_1601108975.webp', '3 Pieces( Mutton)', 14, '2020-09-26 17:59:35', '2020-09-30 12:13:03', 0),
(23, 'Vanila Cake (A123)', 650.00, '26-09-20_1601115463.webp', 'Quantity - 2 pound', 15, '2020-09-26 17:59:57', '2020-09-30 22:07:32', 1),
(24, 'Mutton Do Pyaza', 300.00, '26-09-20_1601109009.webp', '3 Pieces( Mutton)', 14, '2020-09-26 18:00:09', '2020-09-30 12:13:10', 0),
(25, 'Mutton Curry', 300.00, '26-09-20_1601109433.webp', '3 Pieces( Mutton)', 14, '2020-09-26 18:07:13', '2020-09-30 12:13:17', 0),
(26, 'Mutton Kadai', 300.00, '26-09-20_1601109932.webp', '3 Pieces( Mutton)', 14, '2020-09-26 18:15:32', '2020-09-30 12:13:31', 0),
(27, 'Chicken Curry', 190.00, '26-09-20_1601111220.webp', '3 Pieces (Chicken)', 14, '2020-09-26 18:37:00', '2020-09-30 12:13:39', 0),
(28, 'Chicken Masala', 200.00, '26-09-20_1601115795.webp', '3 Pieces (Chicken)', 14, '2020-09-26 19:53:15', '2020-09-30 12:13:46', 0),
(29, 'Laziz khas', 115.00, '26-09-20_1601115945.webp', 'S size (pizza with tangy twist & toppings)', 16, '2020-09-26 19:55:45', '2020-10-14 19:08:32', 1),
(30, 'Laziz khas', 179.00, '26-09-20_1601116414.webp', 'M size (pizza with tangy twist & toppings)', 16, '2020-09-26 20:03:34', '2020-10-14 19:09:18', 1),
(31, 'Laziz khas', 252.00, '26-09-20_1601116637.webp', 'L size (pizza with tangy twist & toppings)', 16, '2020-09-26 20:07:17', '2020-10-14 19:12:24', 1),
(32, 'Laziz desi', 115.00, '26-09-20_1601117152.jpg', 'S size (Tomato, Onion, Capsicum )', 16, '2020-09-26 20:15:52', '2020-10-14 19:08:45', 1),
(33, 'Laziz desi', 179.00, '26-09-20_1601117197.jpg', 'M size (Tomato, Onion, Capsicum )', 16, '2020-09-26 20:16:37', '2020-10-14 19:09:30', 1),
(34, 'Laziz desi', 252.00, '26-09-20_1601117306.jpg', 'L size (Tomato, Onion, Capsicum )', 16, '2020-09-26 20:18:26', '2020-10-14 19:12:36', 1),
(35, 'Mix Veg', 170.00, '26-09-20_1601117563.webp', 'Quantity-1', 14, '2020-09-26 20:22:43', '2020-09-30 12:13:51', 1),
(36, 'Chef\'s special', 126.00, '26-09-20_1601117664.webp', 'S size(Bell peppers & Cottage cheese)', 16, '2020-09-26 20:24:24', '2020-10-14 19:12:56', 1),
(37, 'Chef\'s special', 189.00, '26-09-20_1601117722.webp', 'M size(Bell peppers & Cottage cheese)', 16, '2020-09-26 20:25:22', '2020-10-14 19:13:15', 1),
(38, 'Chef\'s special', 285.00, '26-09-20_1601117756.webp', 'L size(Bell peppers & Cottage cheese)', 16, '2020-09-26 20:25:56', '2020-10-14 19:13:31', 1),
(39, 'Malai Kofta (Sweet Gravy)', 200.00, '26-09-20_1601118082.webp', 'Quantity-1', 14, '2020-09-26 20:31:22', '2020-09-30 12:13:57', 1),
(40, 'Shahi Paneer', 190.00, '26-09-20_1601118121.webp', 'Quantity-1', 14, '2020-09-26 20:32:01', '2020-09-30 12:14:02', 1),
(41, 'Veg Manchurian', 180.00, '26-09-20_1601119729.webp', 'Quantity- 1 Bowl', 14, '2020-09-26 20:58:49', '2020-09-30 12:14:08', 1),
(42, 'Paneer Chilli', 200.00, '26-09-20_1601119836.webp', 'Quantity- 1', 14, '2020-09-26 21:00:36', '2020-10-24 18:02:12', 1),
(43, 'Paneer Butter Masala', 220.00, '26-09-20_1601119874.webp', 'Quantity- 1', 14, '2020-09-26 21:01:14', '2020-09-30 12:14:18', 1),
(44, 'Paneer Do-Pyaza', 180.00, '26-09-20_1601121541.webp', 'Quantity-1', 14, '2020-09-26 21:29:01', '2020-09-30 12:14:23', 1),
(45, 'Kadai Paneer', 190.00, '26-09-20_1601121579.webp', 'Quantity- 1', 14, '2020-09-26 21:29:39', '2020-09-30 12:14:28', 1),
(46, 'Paneer Handi', 200.00, '26-09-20_1601131162.webp', 'Quantity-1', 14, '2020-09-27 00:09:22', '2020-09-30 12:14:33', 1),
(47, 'vanila and chocolate mixCake (A71)', 300.00, '26-09-20_1601141036.webp', 'Quantity - 1 pound', 15, '2020-09-27 02:53:56', '2020-09-30 22:07:38', 1),
(48, 'Butterscotch Cake (A106)', 300.00, '26-09-20_1601141109.webp', 'Quantity - 1 pound', 15, '2020-09-27 02:55:09', '2020-09-30 22:07:43', 1),
(49, 'Photo print cake (chocolate )', 600.00, '26-09-20_1601141194.webp', 'Quantity - 1 pound', 15, '2020-09-27 02:56:34', '2020-09-30 22:07:48', 1),
(50, 'Chocolate cake(Am)', 1400.00, '26-09-20_1601141321.webp', 'Quantity - 4 pound', 15, '2020-09-27 02:58:41', '2020-09-30 22:07:53', 1),
(51, 'Veg Hyderabadi Biryani', 190.00, '26-09-20_1601142807.webp', 'Quantity-1 Plate', 14, '2020-09-27 03:23:27', '2020-09-30 12:14:39', 1),
(52, 'Chicken Biryani', 230.00, '26-09-20_1601142920.webp', 'Egg(1Piece) and Chicken(2 Pieces)', 14, '2020-09-27 03:25:20', '2020-09-30 12:14:47', 0),
(53, 'Chicken Hyderabadi Biryani', 260.00, '26-09-20_1601142982.webp', 'Egg(1 Piece) and Chicken(2 Pieces)', 14, '2020-09-27 03:26:22', '2020-09-30 12:14:53', 0),
(54, 'Pineapple Cake (A97)', 300.00, '27-09-20_1601184845.webp', 'Quantity - 1 pound', 15, '2020-09-27 15:04:05', '2020-09-30 22:08:00', 1),
(55, 'Chocolate cake(A86)', 350.00, '27-09-20_1601184970.webp', 'Quantity - 1 pound', 15, '2020-09-27 15:06:10', '2020-09-30 22:08:06', 1),
(56, 'Mutton Dry Fry', 250.00, '27-09-20_1601192913.webp', '8 Pieces', 14, '2020-09-27 17:18:33', '2020-09-30 12:15:00', 0),
(57, 'Chicken Dry Fry', 180.00, '27-09-20_1601193444.webp', '8 Pieces', 14, '2020-09-27 17:27:24', '2020-09-30 12:15:07', 0),
(58, 'Chicken Lolipop', 200.00, '27-09-20_1601194426.webp', '8 Pieces', 14, '2020-09-27 17:43:46', '2020-09-30 12:15:19', 0),
(59, 'Chicken Chilli', 200.00, '27-09-20_1601194470.webp', '8 Pieces', 14, '2020-09-27 17:44:30', '2020-09-30 12:15:27', 0),
(60, 'Chicken Burger', 120.00, '27-09-20_1601194970.webp', 'Quantity-1', 14, '2020-09-27 17:52:50', '2020-09-30 12:15:36', 0),
(61, 'Chicken Pakora', 180.00, '27-09-20_1601195001.webp', '8 Pieces', 14, '2020-09-27 17:53:21', '2020-09-30 12:15:45', 0),
(62, 'Veg Cutlet', 100.00, '27-09-20_1601195414.webp', '2 Pieces', 14, '2020-09-27 18:00:14', '2020-09-30 12:15:52', 1),
(63, 'Carnival', 126.00, '27-09-20_1601219539.webp', 'S size(Corn,Tomato, Capsicum, Jalapeno, Mushroom)', 16, '2020-09-28 00:42:19', '2020-10-14 19:14:47', 1),
(64, 'Carnival', 189.00, '27-09-20_1601219588.webp', 'M size(Corn,Tomato, Capsicum, Jalapeno, Mushroom)', 16, '2020-09-28 00:43:08', '2020-10-14 19:15:06', 1),
(65, 'Carnival', 285.00, '27-09-20_1601219636.webp', 'L size(Corn,Tomato, Capsicum, Jalapeno, Mushroom)', 16, '2020-09-28 00:43:56', '2020-10-14 19:13:41', 1),
(66, 'Veg paprika', 126.00, '27-09-20_1601219967.webp', 'S size (paneer, corn, capsicum, paprika)', 16, '2020-09-28 00:49:27', '2020-10-14 19:15:16', 1),
(67, 'Veg paprika', 189.00, '27-09-20_1601220039.webp', 'M size (paneer, corn, capsicum, paprika)', 16, '2020-09-28 00:50:39', '2020-10-14 19:15:23', 1),
(68, 'Veg paprika', 285.00, '27-09-20_1601220095.webp', 'L size (paneer, corn, capsicum, paprika)', 16, '2020-09-28 00:51:35', '2020-10-14 19:13:51', 1),
(69, 'Paneer paprika', 126.00, '27-09-20_1601220354.webp', 'S size (Peppered paneer, Paprika)', 16, '2020-09-28 00:55:54', '2020-10-14 19:15:36', 1),
(70, 'Paneer paprika', 189.00, '27-09-20_1601220393.webp', 'M size(Peppered paneer, Paprika)', 16, '2020-09-28 00:56:33', '2020-10-14 19:15:55', 1),
(71, 'Paneer paprika', 285.00, '27-09-20_1601220448.webp', 'L size(Peppered paneer, Paprika)', 16, '2020-09-28 00:57:28', '2020-10-14 19:14:02', 1),
(72, 'Masala Dosa', 140.00, '27-09-20_1601221191.webp', 'Quantity-1', 14, '2020-09-28 01:09:51', '2020-09-30 12:16:00', 1),
(73, 'Paneer Chilli Dosa', 220.00, '27-09-20_1601221236.webp', 'Quantity-1', 14, '2020-09-28 01:10:36', '2020-09-30 12:16:08', 1),
(74, 'Veg Uttapam', 80.00, '27-09-20_1601221382.webp', 'Delicious South Indian food', 14, '2020-09-28 01:13:02', '2020-09-30 12:16:15', 1),
(75, 'Veg Steam Momo', 60.00, '27-09-20_1601223634.webp', 'Delicious', 14, '2020-09-28 01:50:34', '2020-09-30 12:16:20', 1),
(76, 'Veg Fried Momo', 80.00, '27-09-20_1601223673.webp', 'Hot and Delicious', 14, '2020-09-28 01:51:13', '2020-09-30 12:16:27', 1),
(77, 'Veg Chilli Momo', 150.00, '27-09-20_1601223718.webp', 'Spicy and tasty', 14, '2020-09-28 01:51:58', '2020-09-30 12:16:33', 1),
(80, 'Veg Chowmin', 100.00, '27-09-20_1601225459.webp', 'An important part of your evening break', 14, '2020-09-28 02:20:59', '2020-09-30 12:16:39', 1),
(82, 'Paneer Chowmin', 180.00, '27-09-20_1601225535.webp', 'The important part of your evening time', 14, '2020-09-28 02:22:15', '2020-09-30 12:16:47', 1),
(83, 'Plane dosa', 35.00, '27-09-20_1601225709.webp', 'quantity :-1', 19, '2020-09-28 02:25:09', '2020-10-09 20:17:33', 1),
(85, 'Masala dosa', 40.00, '27-09-20_1601225835.webp', 'quantity :-1', 19, '2020-09-28 02:27:15', '2020-10-09 20:17:49', 1),
(92, 'Veg Chilli Garlic Noodles', 140.00, '27-09-20_1601230998.webp', 'Quantity-1 Plate', 14, '2020-09-28 03:53:18', '2020-09-30 12:16:54', 1),
(93, 'Veg Schezwan Noodles', 150.00, '27-09-20_1601231042.webp', 'Quantity-1 Plate', 14, '2020-09-28 03:54:02', '2020-09-30 12:17:02', 1),
(95, 'Veg chilli Momo', 60.00, '28-09-20_1601267462.webp', 'Hot and spicy', 19, '2020-09-28 14:01:02', '2020-09-30 12:19:28', 1),
(96, 'Veg Steam Momo', 40.00, '28-09-20_1601267546.webp', 'Tasty and delicious', 19, '2020-09-28 14:02:26', '2020-09-30 12:19:33', 1),
(97, 'Veg Fried Momo', 60.00, '28-09-20_1601267756.webp', 'Hot and tasty', 19, '2020-09-28 14:05:56', '2020-09-30 12:19:39', 1),
(98, 'Chowmim', 40.00, '28-09-20_1601267875.webp', 'Hot and Delicious', 19, '2020-09-28 14:07:55', '2020-09-30 12:19:45', 1),
(100, 'RumPum', 30.00, '28-09-20_1601268317.webp', 'VEG NOODLES RUMPUM', 19, '2020-09-28 14:15:17', '2020-09-30 12:19:54', 1),
(101, 'Paneer Dosa', 50.00, '28-09-20_1601268629.webp', 'Quantity:-1', 19, '2020-09-28 14:20:29', '2020-10-09 20:18:08', 1),
(102, 'Burger', 35.00, '28-09-20_1601270178.webp', 'Quantity:-1', 19, '2020-09-28 14:46:18', '2020-10-09 20:18:24', 1),
(103, 'CHOCO TRUFFLE CAKE', 600.00, '28-09-20_1601270276.webp', '1 pound', 18, '2020-09-28 14:47:56', '2020-09-28 15:11:08', NULL),
(104, 'Paneer Tikka', 70.00, '28-09-20_1601270461.webp', 'Tasty and delicious', 19, '2020-09-28 14:51:01', '2020-09-30 12:20:10', 1),
(105, 'Black Forest', 490.00, '28-09-20_1601270600.webp', '1 pound', 18, '2020-09-28 14:53:20', '2020-09-28 15:11:19', NULL),
(106, 'BLACK FOREST', 490.00, '28-09-20_1601270783.webp', '1 pound', 18, '2020-09-28 14:56:23', '2020-09-28 15:11:30', NULL),
(107, 'VANILA (CUSTOMISED CAKE )', 690.00, '28-09-20_1601271269.webp', '1 pound', 18, '2020-09-28 15:04:29', '2020-09-28 15:10:56', NULL),
(108, 'DOREMON CAKE  ( Vanila )', 840.00, '28-09-20_1601271371.webp', '2 pound', 18, '2020-09-28 15:06:11', '2020-09-28 15:06:11', NULL),
(109, 'FLORAL CAKE', 690.00, '28-09-20_1601271634.webp', '1 pound', 18, '2020-09-28 15:10:34', '2020-09-28 15:10:34', NULL),
(110, 'VANILA CAKE', 440.00, '28-09-20_1601274966.webp', '1 pound', 18, '2020-09-28 16:06:06', '2020-09-28 16:06:06', NULL),
(111, 'CHOCOLATE CAKE', 540.00, '28-09-20_1601275295.webp', '1 pound', 18, '2020-09-28 16:11:35', '2020-09-28 16:11:35', NULL),
(112, 'Vanila Cake (A28)', 300.00, '28-09-20_1601281684.webp', 'Quantity - 1 pound', 15, '2020-09-28 17:58:04', '2020-09-30 22:08:11', 1),
(113, 'Choco - vanila cake(A74)', 300.00, '28-09-20_1601281871.webp', 'Quantity - 1 pound', 15, '2020-09-28 18:01:11', '2020-09-30 22:08:17', 1),
(114, 'Vanila Cake (A72)', 300.00, '28-09-20_1601281981.webp', 'Quantity - 1 pound', 15, '2020-09-28 18:03:01', '2020-09-30 22:08:22', 1),
(115, 'Vanila - strawberry cake (A88)', 600.00, '28-09-20_1601282099.webp', 'Quantity - 1 pound', 15, '2020-09-28 18:04:59', '2020-09-30 22:08:29', 1),
(116, 'Mushroom Matar', 180.00, '28-09-20_1601294003.webp', 'Healthy food with a good taste', 14, '2020-09-28 21:23:23', '2020-09-30 12:17:07', 1),
(117, 'Mushroom Butter Masala', 220.00, '28-09-20_1601294066.webp', 'Healthy and tasty', 14, '2020-09-28 21:24:26', '2020-09-30 12:17:13', 1),
(118, 'Veg Sandwich', 70.00, '28-09-20_1601294149.webp', '4 Pieces', 14, '2020-09-28 21:25:49', '2020-09-30 12:17:19', 1),
(119, 'Bread Omelette', 80.00, '28-09-20_1601294264.webp', '2 Pieces', 14, '2020-09-28 21:27:44', '2020-09-30 12:17:26', 0),
(126, 'Mutton Steam MoMos', 80.00, '30-09-20_1601472701.webp', '1 plate', 20, '2020-09-29 17:10:41', '2020-09-30 23:03:35', 0),
(127, 'Mushroom Chilli', 220.00, '30-09-20_1601433278.webp', 'Nutritious and delicious in taste', 14, '2020-09-30 12:04:38', '2020-09-30 12:04:38', 1),
(128, 'Paneer Pakora', 120.00, '30-09-20_1601433523.webp', 'Fresh Ingredients are used and are delicious.', 14, '2020-09-30 12:08:43', '2020-09-30 12:08:43', 1),
(130, 'Chicken Steam MoMo', 60.00, '30-09-20_1601482062.webp', '1 plate', 20, '2020-10-01 01:37:42', '2020-10-01 01:37:42', 0),
(131, 'Chicken Fry MoMo', 80.00, '30-09-20_1601482199.webp', '1 plate', 20, '2020-10-01 01:39:59', '2020-10-01 01:39:59', 0),
(132, 'Mutton Fry MoMo', 100.00, '30-09-20_1601482268.webp', '1 Plate', 20, '2020-10-01 01:41:08', '2020-10-01 01:55:56', 0),
(133, 'Mutton Rumpum', 80.00, '30-09-20_1601483230.webp', '1 plate', 20, '2020-10-01 01:57:10', '2020-10-01 01:57:10', 0),
(134, 'Chicken RumPum', 60.00, '30-09-20_1601483326.webp', '1 plate', 20, '2020-10-01 01:58:46', '2020-10-01 02:10:51', 0),
(135, 'Chicken Egg RumPum', 80.00, '30-09-20_1601483394.webp', '1 plate', 20, '2020-10-01 01:59:54', '2020-10-01 01:59:54', 0),
(136, 'Mutton Egg RumPum', 100.00, '30-09-20_1601484690.webp', '1 plate', 20, '2020-10-01 02:21:30', '2020-10-01 02:21:30', 0),
(137, 'Mutton Sekua', 150.00, '30-09-20_1601485709.webp', '8 pcs', 20, '2020-10-01 02:38:29', '2020-10-04 21:33:59', 0),
(138, 'Chicken Sekua', 120.00, '30-09-20_1601485953.webp', '8 pcs', 20, '2020-10-01 02:42:33', '2020-10-04 21:34:16', 0),
(139, 'Chicken Leg', 50.00, '30-09-20_1601486014.webp', '1 pcs', 20, '2020-10-01 02:43:34', '2020-10-04 21:34:28', 0),
(140, 'Chicken Chowmin', 60.00, '30-09-20_1601486705.webp', '1 plate', 20, '2020-10-01 02:55:05', '2020-10-01 02:55:05', 0),
(141, 'Chicken Egg Chowmin', 80.00, '30-09-20_1601486775.webp', '1 plate', 20, '2020-10-01 02:56:15', '2020-10-01 02:56:15', 0),
(142, 'Mutton Chowmin', 80.00, '30-09-20_1601486825.webp', '1 plate', 20, '2020-10-01 02:57:05', '2020-10-01 02:57:05', 0),
(145, 'Mutton Egg Chowmin', 100.00, '30-09-20_1601486903.webp', '1 plate', 20, '2020-10-01 02:58:23', '2020-10-01 02:58:23', 0),
(147, 'Double Egg Roll', 40.00, '01-10-20_1601525992.webp', '1 pcs', 20, '2020-10-01 13:49:52', '2020-10-04 21:34:44', 0),
(148, 'Double Egg Chicken Roll', 60.00, '01-10-20_1601526075.webp', '1 plate', 20, '2020-10-01 13:51:15', '2020-10-01 13:51:15', 0),
(149, 'Double Egg Mutton Roll', 80.00, '01-10-20_1601526133.webp', '1 plate', 20, '2020-10-01 13:52:13', '2020-10-01 13:52:13', 0),
(150, 'Chicken Dosa', 80.00, '01-10-20_1601526441.webp', '1 plate', 20, '2020-10-01 13:57:21', '2020-10-01 13:57:21', 0),
(151, 'Mutton Dosa', 100.00, '01-10-20_1601526477.webp', '1 plate', 20, '2020-10-01 13:57:57', '2020-10-01 13:57:57', 0),
(152, 'Chicken Biryani', 120.00, '01-10-20_1601526541.webp', '1 plate', 20, '2020-10-01 13:59:01', '2020-10-01 13:59:01', 0),
(153, 'Mutton Biryani', 140.00, '01-10-20_1601526586.webp', '1 plate', 20, '2020-10-01 13:59:46', '2020-10-01 13:59:46', 0),
(154, 'Chicken Dry Kabab', 120.00, '01-10-20_1601526816.webp', '6 pcs', 20, '2020-10-01 14:03:36', '2020-10-04 21:34:57', 0),
(155, 'Mutton Dry Kabab', 150.00, '01-10-20_1601526848.webp', '6 pcs', 20, '2020-10-01 14:04:08', '2020-10-04 21:35:04', 0),
(156, 'Veg Steam MoMo', 50.00, '01-10-20_1601527777.webp', '1 plate', 20, '2020-10-01 14:19:37', '2020-10-01 14:19:37', 1),
(157, 'Veg Chili MoMo', 100.00, '01-10-20_1601527827.webp', '1 plate', 20, '2020-10-01 14:20:27', '2020-10-01 14:20:27', 1),
(158, 'Veg Dry MoMo', 70.00, '01-10-20_1601527895.webp', '1 plate', 20, '2020-10-01 14:21:35', '2020-10-01 14:21:35', 1),
(159, 'Masala Dosa', 50.00, '01-10-20_1601547099.webp', '1 plate', 20, '2020-10-01 19:41:39', '2020-10-01 19:41:39', 1),
(160, 'Paneer Dosa', 70.00, '01-10-20_1601547202.webp', '1 plate', 20, '2020-10-01 19:42:23', '2020-10-01 19:43:52', 1),
(161, 'Paper Dosa', 40.00, '01-10-20_1601547275.webp', '1 plate', 20, '2020-10-01 19:44:35', '2020-10-01 19:44:35', 1),
(162, 'Butter Dosa', 70.00, '01-10-20_1601547327.webp', '1 plate', 20, '2020-10-01 19:45:27', '2020-10-01 19:45:27', 1),
(171, 'Veg Burger', 40.00, '02-10-20_1601625707.webp', '1 pcs', 20, '2020-10-02 17:31:47', '2020-10-02 17:31:47', 1),
(172, 'Paneer Burger', 50.00, '02-10-20_1601625784.webp', '1 pcs', 20, '2020-10-02 17:33:04', '2020-10-02 17:33:04', 1),
(173, 'Plain Tawa Roti', 15.00, '12-10-20_1602478657.webp', '1 Pc', 14, '2020-10-12 14:01:34', '2020-10-12 14:27:37', 1),
(174, 'Butter Tawa Roti', 20.00, '12-10-20_1602478676.webp', '1 Pc', 14, '2020-10-12 14:03:17', '2020-10-12 14:27:56', 1),
(175, 'Butter Tandoori Roti', 20.00, '12-10-20_1602478696.webp', '1 Pc', 14, '2020-10-12 14:05:15', '2020-10-12 14:28:16', 1),
(176, 'Plain Kulcha', 40.00, '12-10-20_1602478633.webp', '1 Pc', 14, '2020-10-12 14:27:13', '2020-10-12 14:27:13', 1),
(177, 'Cheese Butter Naan', 90.00, '12-10-20_1602478743.webp', '1 Pc', 14, '2020-10-12 14:29:03', '2020-10-12 14:29:03', 1),
(178, 'Butter Naan', 40.00, '12-10-20_1602479215.webp', '1 Pc', 14, '2020-10-12 14:36:55', '2020-10-12 14:36:55', 1),
(179, 'Lachha Paratha', 50.00, '12-10-20_1602480937.webp', '1 Pc', 14, '2020-10-12 15:05:37', '2020-10-12 15:05:37', 1),
(180, 'Plain Rice', 70.00, '12-10-20_1602481593.webp', '1 Plate', 14, '2020-10-12 15:16:33', '2020-10-12 15:16:33', 1),
(181, 'Plain Rice', 50.00, '12-10-20_1602481631.webp', '1/2 Plate', 14, '2020-10-12 15:17:11', '2020-10-12 15:17:11', 1),
(182, 'Jeera Rice', 90.00, '12-10-20_1602482107.webp', '1 Plate', 14, '2020-10-12 15:25:07', '2020-10-12 15:25:07', 1),
(183, 'Jeera Rice', 60.00, '12-10-20_1602482135.webp', '1/2 Plate', 14, '2020-10-12 15:25:35', '2020-10-12 15:25:35', 1),
(184, 'Veg Fried Rice', 150.00, '12-10-20_1602487105.webp', '1 Plate', 14, '2020-10-12 16:48:25', '2020-10-12 16:48:25', 1),
(185, 'Pani Puri', 10.00, '12-10-20_1602492808.webp', '6 pcs', 23, '2020-10-12 18:23:28', '2020-10-12 18:23:28', 1),
(186, 'Tikia  Chat', 20.00, '12-10-20_1602492848.webp', '1 Plate', 23, '2020-10-12 18:24:08', '2020-10-12 18:24:08', 1),
(187, 'Papri Chat', 20.00, '12-10-20_1602492878.webp', '1 Plate', 23, '2020-10-12 18:24:38', '2020-10-12 18:24:38', 1),
(188, 'Mixed Chat', 20.00, '12-10-20_1602492904.webp', '1 Plate', 23, '2020-10-12 18:25:04', '2020-10-12 18:25:04', 1),
(189, 'Fuchka Chat', 20.00, '12-10-20_1602513751.webp', '1 Plate', 23, '2020-10-13 00:12:32', '2020-10-13 00:12:32', 1),
(190, 'Dahi Bara', 30.00, '12-10-20_1602513822.webp', '1 Plate', 23, '2020-10-13 00:13:42', '2020-10-13 00:13:42', 1),
(191, 'Aalu Chop', 5.00, '12-10-20_1602519307.jpg', '1 Pc', 24, '2020-10-13 01:45:07', '2020-10-16 02:45:53', 1),
(192, 'Egg Chop', 10.00, '12-10-20_1602520113.webp', '1 Pc', 24, '2020-10-13 01:58:33', '2020-10-16 02:46:01', 1),
(193, 'Chicken Briyani', 60.00, '12-10-20_1602520251.webp', 'Full plate', 24, '2020-10-13 02:00:51', '2020-10-13 02:01:59', 0),
(194, 'Chicken Biryani', 30.00, '12-10-20_1602520307.webp', 'Half plate', 24, '2020-10-13 02:01:47', '2020-10-13 02:01:47', 0),
(195, 'Nariyal Chop', 5.00, '12-10-20_1602520409.webp', '1 Pc', 24, '2020-10-13 02:03:29', '2020-10-16 02:46:11', 1),
(196, 'Vegetables Chop', 5.00, '12-10-20_1602520547.webp', '1 Pc', 24, '2020-10-13 02:05:47', '2020-10-16 02:46:20', 1),
(197, 'Chicken Pakoda', 40.00, '12-10-20_1602520638.webp', '8 Pc', 24, '2020-10-13 02:07:18', '2020-10-16 02:46:27', 1),
(198, 'Chicken Pakoda', 20.00, '12-10-20_1602520686.webp', '4 Pc', 24, '2020-10-13 02:08:06', '2020-10-16 02:46:35', 1),
(199, 'Veg Momos', 30.00, '13-10-20_1602562941.webp', 'Full plate', 25, '2020-10-13 13:52:21', '2020-10-13 13:52:21', 1),
(200, 'Veg MoMos', 15.00, '13-10-20_1602563083.webp', 'Half plate', 25, '2020-10-13 13:54:43', '2020-10-13 13:54:43', 1),
(201, 'Chicken MoMos', 40.00, '13-10-20_1602563269.webp', 'Full plate', 25, '2020-10-13 13:57:49', '2020-10-13 13:57:49', 0),
(202, 'Chicken MoMos', 20.00, '13-10-20_1602563455.webp', 'Half plate', 25, '2020-10-13 14:00:55', '2020-10-13 14:00:55', 0),
(203, 'Veg Chilli MoMos', 50.00, '13-10-20_1602563612.webp', 'Full plate', 25, '2020-10-13 14:03:32', '2020-10-13 14:03:32', 1),
(204, 'Veg Chilli MoMos', 25.00, '13-10-20_1602563708.webp', 'Half plate', 25, '2020-10-13 14:05:08', '2020-10-13 14:05:08', 1),
(205, 'Chiken Chilli MoMos', 60.00, '13-10-20_1602564096.webp', 'Full plate', 25, '2020-10-13 14:11:36', '2020-10-13 14:16:27', 0),
(208, 'Veg Soup', 15.00, '15-10-20_1602734349.webp', 'Full', 25, '2020-10-15 13:29:09', '2020-10-15 13:29:09', 1),
(209, 'Chicken Soup', 15.00, '15-10-20_1602734441.webp', 'Full', 25, '2020-10-15 13:30:41', '2020-10-15 13:30:41', 1),
(210, 'VEG CHOWMIN', 25.00, '15-10-20_1602734872.webp', 'Quantity - Full plate', 27, '2020-10-15 13:37:52', '2020-10-15 13:37:52', 1),
(211, 'Egg chowmin', 35.00, '15-10-20_1602738676.webp', 'Quantity - Full plate', 27, '2020-10-15 14:41:16', '2020-10-15 14:41:16', 0),
(212, 'Chicken chowmin', 60.00, '15-10-20_1602739078.webp', 'Quantity - full plate', 27, '2020-10-15 14:47:58', '2020-10-15 14:47:58', 0),
(213, 'Egg chicken chowmin', 70.00, '15-10-20_1602739439.webp', 'Quantity - Full plate', 27, '2020-10-15 14:53:59', '2020-10-15 14:53:59', 0),
(214, 'Veg Pasta', 30.00, '15-10-20_1602739812.webp', 'Quantity - Full plate', 27, '2020-10-15 15:00:12', '2020-10-15 15:00:12', 1),
(215, 'Egg pasta', 40.00, '15-10-20_1602746418.webp', 'Quantity - Full plate', 27, '2020-10-15 15:04:39', '2020-10-15 16:50:18', 1),
(216, 'Chicken pasta', 60.00, '15-10-20_1602740261.webp', 'Quantity - Full plate', 27, '2020-10-15 15:07:41', '2020-10-15 15:07:41', 0),
(217, 'Egg chicken pasta', 70.00, '15-10-20_1602740660.webp', 'Quantity - Full plate', 27, '2020-10-15 15:14:20', '2020-10-15 15:14:20', 0),
(218, 'Egg roll', 25.00, '15-10-20_1602741082.webp', 'Quantity - 1 piece', 27, '2020-10-15 15:21:22', '2020-10-15 15:21:22', 0),
(219, 'Egg chicken roll', 40.00, '15-10-20_1602741528.webp', 'Quantity - 1 Piece', 27, '2020-10-15 15:28:48', '2020-10-15 15:28:48', 0),
(220, 'Customized Cake(1)', 400.00, '15-10-20_1602744046.webp', 'Tasty & delicious', 28, '2020-10-15 16:10:46', '2020-10-15 19:41:30', 1),
(221, 'Customized Cake(2)', 600.00, '15-10-20_1602744135.webp', 'Tasty & delicious', 28, '2020-10-15 16:12:15', '2020-10-15 19:41:39', 1),
(222, 'Customized Cake(3)', 600.00, '15-10-20_1602744224.webp', 'Tasty & delicious', 28, '2020-10-15 16:13:44', '2020-10-15 19:41:49', 1),
(223, 'Customized Cake(4)', 1000.00, '15-10-20_1602744259.webp', 'Tasty & delicious', 28, '2020-10-15 16:14:19', '2020-10-15 19:42:01', 1),
(224, 'Customized Cake(5)', 1100.00, '15-10-20_1602744299.webp', 'Tasty & delicious', 28, '2020-10-15 16:14:59', '2020-10-15 19:42:13', 1),
(225, 'Doll Cake', 1200.00, '15-10-20_1602744516.webp', 'Tasty & delicious', 28, '2020-10-15 16:18:36', '2020-10-15 16:18:36', 1),
(226, 'Customized Cake(6)', 1400.00, '15-10-20_1602744549.webp', 'Tasty & delicious', 28, '2020-10-15 16:19:09', '2020-10-15 19:42:28', 1),
(227, 'Vanila Cake', 220.00, '15-10-20_1602776015.webp', 'Tasty & delicious', 28, '2020-10-16 01:03:35', '2020-10-16 01:03:35', 1),
(228, 'Pineapple Cake', 250.00, '15-10-20_1602776051.webp', 'Tasty & delicious', 28, '2020-10-16 01:04:11', '2020-10-16 01:04:11', 1),
(229, 'Strawberry Cake', 250.00, '15-10-20_1602776086.webp', 'Tasty & delicious', 28, '2020-10-16 01:04:46', '2020-10-16 01:04:46', 1),
(230, 'Orange Cake', 250.00, '15-10-20_1602776128.webp', 'Tasty & delicious', 28, '2020-10-16 01:05:28', '2020-10-16 01:05:28', 1),
(231, 'Blue Berry Cake', 250.00, '15-10-20_1602776187.webp', 'Tasty & delicious', 28, '2020-10-16 01:06:27', '2020-10-16 01:06:27', 1),
(232, 'Chocolate Cake', 300.00, '15-10-20_1602776230.webp', 'Tasty & delicious', 28, '2020-10-16 01:07:10', '2020-10-16 01:07:10', 1),
(233, 'Black Forest Cake', 300.00, '15-10-20_1602776261.webp', 'Tasty & delicious', 28, '2020-10-16 01:07:41', '2020-10-16 01:07:41', 1),
(234, 'Black Carrent Cake', 250.00, '15-10-20_1602776352.webp', 'Tasty & delicious', 28, '2020-10-16 01:09:12', '2020-10-16 01:09:12', 1),
(235, 'Soyabin Chop', 6.00, '15-10-20_1602782319.webp', '1 Pc', 24, '2020-10-16 02:48:39', '2020-10-16 02:48:39', 1),
(236, 'Chicken lollipop', 28.00, '15-10-20_1602782380.webp', '1 Pc', 24, '2020-10-16 02:49:40', '2020-10-16 02:49:40', 0),
(237, 'Machli Anda Chop', 6.00, '15-10-20_1602782467.jpg', '1 Pc', 24, '2020-10-16 02:51:07', '2020-10-16 02:51:07', 0),
(238, 'Chicken Chop', 10.00, '15-10-20_1602782566.webp', '1 Pc', 24, '2020-10-16 02:52:46', '2020-10-16 02:52:46', 0),
(239, 'Mushroom chop', 6.00, '15-10-20_1602782663.jpg', '1 Pc', 24, '2020-10-16 02:54:23', '2020-10-16 02:54:23', 1),
(240, 'Bread Chop', 6.00, '15-10-20_1602782816.webp', '1 Pc', 24, '2020-10-16 02:56:56', '2020-10-16 02:56:56', 1),
(241, 'Chindi machli', 7.00, '15-10-20_1602782983.webp', '1 Pc', 24, '2020-10-16 02:59:43', '2020-10-16 02:59:43', 0),
(242, 'Chicken kosha', 10.00, '15-10-20_1602783069.webp', '1 Pc', 24, '2020-10-16 03:01:09', '2020-10-16 03:01:09', 0),
(243, 'Capsicum Onion Pizza', 100.00, '17-10-20_1602920661.webp', 'Taste is awesome 👌; Quantity-1', 29, '2020-10-17 17:14:21', '2020-10-17 17:17:26', 1),
(244, 'Paneer Pizza', 120.00, '17-10-20_1602920736.webp', 'Made with best & quality ingredients ;Quantity-1', 29, '2020-10-17 17:15:36', '2020-10-17 17:18:00', 1),
(245, 'Bread Pizza', 25.00, '17-10-20_1602920773.webp', '1 Pc', 29, '2020-10-17 17:16:13', '2020-10-31 18:38:04', 1),
(247, 'Fried Rice', 100.00, '17-10-20_1602920828.webp', '1 Plate', 29, '2020-10-17 17:17:08', '2020-10-17 17:17:08', 1),
(248, 'Jalebi', 140.00, '19-10-20_1603080353.webp', '1 Kg', 30, '2020-10-19 13:35:53', '2020-10-19 13:35:53', 1),
(249, 'Jalebi', 70.00, '19-10-20_1603080375.webp', '1/2 Kg', 30, '2020-10-19 13:36:15', '2020-10-19 13:36:15', 1),
(250, 'Panipuri', 20.00, '23-10-20_1603436477.webp', '10 pieces                                                      Delicious and yummy', 31, '2020-10-23 16:31:17', '2020-10-23 21:04:59', 1),
(251, 'Papri chat', 30.00, '23-10-20_1603436531.webp', 'Delicious and yummy', 31, '2020-10-23 16:32:11', '2020-10-23 16:32:11', 1),
(252, 'bread paneer pizza', 30.00, '31-10-20_1604138619.webp', 'Quantity :- 1', 29, '2020-10-31 19:33:39', '2020-10-31 19:33:39', 1),
(253, 'JAR CAKE', 75.00, '05-11-20_1604564800.webp', 'Pineapple , chocolate , strawberry flavour', 18, '2020-11-05 18:56:40', '2020-11-05 18:56:40', 1),
(254, 'Oreo Jar Cake', 80.00, '05-11-20_1604564899.webp', 'Pure veg', 18, '2020-11-05 18:58:19', '2020-11-05 18:58:19', 1),
(255, 'Samosa', 7.00, '05-11-20_1604588904.webp', '1 Piece', 28, '2020-11-06 01:38:24', '2020-11-06 01:38:24', 1),
(256, 'Kachori', 7.00, '05-11-20_1604588946.webp', '1 Piece', 28, '2020-11-06 01:39:06', '2020-11-06 01:39:06', 1),
(257, 'Paneer Patties', 20.00, '05-11-20_1604588988.webp', '1 Piece', 28, '2020-11-06 01:39:48', '2020-11-06 01:39:48', 1),
(258, 'Veg Patties', 15.00, '05-11-20_1604589038.webp', '1 Piece', 28, '2020-11-06 01:40:38', '2020-11-06 01:40:38', 1),
(259, 'Hot dog', 30.00, '05-11-20_1604589110.webp', '1 Piece', 28, '2020-11-06 01:41:50', '2020-11-06 01:41:50', 1),
(260, 'Pan Pizza', 30.00, '05-11-20_1604589154.webp', '1 Piece', 28, '2020-11-06 01:42:34', '2020-11-06 01:42:34', 1),
(261, 'Veg Burger', 25.00, '05-11-20_1604589204.webp', '1 Piece', 28, '2020-11-06 01:43:24', '2020-11-06 01:43:24', 1),
(262, 'Cheese Burger', 35.00, '05-11-20_1604589248.webp', '1 Piece', 28, '2020-11-06 01:44:08', '2020-11-06 01:44:08', 1),
(263, 'Paneer Kulcha', 25.00, '05-11-20_1604591779.webp', '1 Piece', 28, '2020-11-06 02:26:19', '2020-11-06 02:26:19', 1),
(264, 'Pizza Roll', 35.00, '05-11-20_1604591815.webp', '1 Piece', 28, '2020-11-06 02:26:55', '2020-11-06 02:26:55', 1),
(265, 'Veg Sandwich', 15.00, '05-11-20_1604591844.webp', '1 Piece', 28, '2020-11-06 02:27:24', '2020-11-06 02:27:24', 1),
(266, 'Veg Grilled Sandwich', 40.00, '05-11-20_1604591879.webp', '1 Plate', 28, '2020-11-06 02:27:59', '2020-11-06 02:27:59', 1),
(267, 'Baked Samosa', 15.00, '05-11-20_1604591923.webp', '1 Piece', 28, '2020-11-06 02:28:43', '2020-11-06 02:28:43', 1),
(268, 'Cheese Pizza', 120.00, '05-11-20_1604591957.webp', '1 Piece', 28, '2020-11-06 02:29:17', '2020-11-06 02:29:17', 1),
(269, 'Samosa chat', 25.00, '06-11-20_1604651301.webp', 'Full plate', 33, '2020-11-06 18:58:21', '2020-11-06 18:58:21', 1),
(270, 'Pakori chat', 25.00, '06-11-20_1604652153.webp', 'Full plate', 33, '2020-11-06 19:12:33', '2020-11-06 19:12:33', 1),
(271, 'Pakori', 20.00, '06-11-20_1604652284.webp', 'Tasty', 33, '2020-11-06 19:14:44', '2020-11-06 19:14:44', 1),
(272, 'Kachori chat', 25.00, '06-11-20_1604652412.webp', 'Full plate', 33, '2020-11-06 19:16:52', '2020-11-07 20:23:46', 1),
(273, 'Kachori', 8.00, '06-11-20_1604652652.webp', '1 piece', 33, '2020-11-06 19:20:53', '2020-11-06 19:20:53', 1),
(274, 'Rasgulla', 7.00, '06-11-20_1604670154.webp', '1 Piece', 28, '2020-11-07 00:12:34', '2020-11-07 00:12:34', 1),
(275, 'Rasmalai', 30.00, '06-11-20_1604670181.webp', '1 Plate', 28, '2020-11-07 00:13:01', '2020-11-07 00:13:01', 1),
(276, 'Gulab Jamun', 12.00, '06-11-20_1604670226.webp', '1 Piece', 28, '2020-11-07 00:13:46', '2020-11-07 00:13:46', 1),
(277, 'Rajbhog', 15.00, '06-11-20_1604670263.webp', '1 Piece', 28, '2020-11-07 00:14:23', '2020-11-07 00:14:23', 1),
(278, 'Cream Chop', 300.00, '06-11-20_1604670301.webp', '1 Kg', 28, '2020-11-07 00:15:01', '2020-11-07 00:15:01', 1),
(279, 'Balushahi', 260.00, '06-11-20_1604670336.webp', '1 Kg', 28, '2020-11-07 00:15:36', '2020-11-07 00:15:36', 1),
(280, 'Pakeeza', 300.00, '06-11-20_1604670368.webp', '1 Kg', 28, '2020-11-07 00:16:08', '2020-11-07 00:16:08', 1),
(281, 'Chamcham', 300.00, '06-11-20_1604670409.webp', '1 Kg', 28, '2020-11-07 00:16:49', '2020-11-07 00:16:49', 1),
(282, 'Motichoor Laddu', 160.00, '06-11-20_1604670441.webp', '1 Kg', 28, '2020-11-07 00:17:21', '2020-11-07 00:17:21', 1),
(283, 'Besan Laddu', 160.00, '06-11-20_1604670464.webp', '1 Kg', 28, '2020-11-07 00:17:44', '2020-11-07 00:17:44', 1),
(284, 'Milk Cake', 260.00, '06-11-20_1604670488.webp', '1 Kg', 28, '2020-11-07 00:18:08', '2020-11-07 00:18:08', 1),
(285, 'Cream Sandwich', 300.00, '06-11-20_1604670519.webp', '1 Kg', 28, '2020-11-07 00:18:39', '2020-11-07 00:18:39', 1),
(286, 'Masala Dosa', 40.00, '07-11-20_1604741182.webp', 'Tasty and spicy', 33, '2020-11-07 19:56:22', '2020-11-07 19:56:22', 1),
(287, 'Plain Dosa', 40.00, '07-11-20_1604741237.webp', 'Tasty and spicy', 33, '2020-11-07 19:57:17', '2020-11-07 19:57:17', 1),
(288, 'Paneer Dosa', 80.00, '07-11-20_1604741336.webp', 'Tasty and spicy', 33, '2020-11-07 19:58:56', '2020-11-07 19:58:56', 1),
(289, 'Paneer Masala Dosa', 60.00, '07-11-20_1604741382.webp', 'Tasty and spicy', 33, '2020-11-07 19:59:42', '2020-11-07 20:24:08', 1),
(290, 'Samosa', 8.00, '07-11-20_1604742063.webp', 'Tasty and crunchy', 33, '2020-11-07 20:11:03', '2020-11-07 20:11:03', 1),
(291, 'Paneer', 360.00, '07-11-20_1604742105.webp', '1 kg', 33, '2020-11-07 20:11:45', '2020-11-07 20:11:45', 1),
(292, 'Malai chaap', 25.00, '07-11-20_1604742254.webp', 'Tasty and spicy', 33, '2020-11-07 20:14:14', '2020-11-07 20:14:14', 1),
(293, 'Curd (Dahi)', 130.00, '07-11-20_1604742401.webp', '1 kg', 33, '2020-11-07 20:16:41', '2020-11-07 20:16:41', 1),
(294, 'Papri chat', 25.00, '07-11-20_1604742520.webp', 'Full plate', 33, '2020-11-07 20:18:40', '2020-11-07 20:18:40', 1),
(295, 'Rasgullla', 13.00, '07-11-20_1604742562.webp', '1 piece', 33, '2020-11-07 20:19:22', '2020-11-07 20:19:22', 1);

-- --------------------------------------------------------

--
-- Table structure for table `migrations`
--

CREATE TABLE `migrations` (
  `id` int(10) UNSIGNED NOT NULL,
  `migration` varchar(255) COLLATE utf8mb4_unicode_ci NOT NULL,
  `batch` int(11) NOT NULL
) ENGINE=InnoDB DEFAULT CHARSET=utf8mb4 COLLATE=utf8mb4_unicode_ci;

--
-- Dumping data for table `migrations`
--

INSERT INTO `migrations` (`id`, `migration`, `batch`) VALUES
(4, '2014_10_12_000000_create_users_table', 1),
(5, '2014_10_12_100000_create_password_resets_table', 1),
(6, '2019_08_19_000000_create_failed_jobs_table', 1),
(7, '2020_05_18_034318_add_usertype_to_users', 2),
(8, '2020_05_18_042057_create_posts_table', 3),
(9, '2020_05_18_165529_add_description_to_posts', 4),
(11, '2020_05_19_041412_create_cart_items_table', 5),
(12, '2020_05_19_083031_add_no_of_requests_to_users', 6),
(13, '2020_05_19_152002_add_category_to_posts', 7),
(14, '2020_05_20_083130_add_discount_to_posts', 8),
(15, '2020_05_20_090354_add_discount_to_cart_items', 9);

-- --------------------------------------------------------

--
-- Table structure for table `password_resets`
--

CREATE TABLE `password_resets` (
  `email` varchar(255) COLLATE utf8mb4_unicode_ci NOT NULL,
  `token` varchar(255) COLLATE utf8mb4_unicode_ci NOT NULL,
  `created_at` timestamp NULL DEFAULT NULL
) ENGINE=InnoDB DEFAULT CHARSET=utf8mb4 COLLATE=utf8mb4_unicode_ci;

--
-- Dumping data for table `password_resets`
--

INSERT INTO `password_resets` (`email`, `token`, `created_at`) VALUES
('rajgulshan573@gmail.com', '$2y$10$ITtebO8cLk.rJgWsALemV.miVNuPerXcsJxTQ3/9Pp5Rs4M.8EHr.', '2020-06-10 09:31:48'),
('gaurav.jss.027@gmail.com', '$2y$10$Q6Yi5Yc6hcqmhIL4N/wYyu/9/AbcMl3b5xxClbhFoSc0fnR1mnPrS', '2020-06-10 09:40:05'),
('rahmatkhanrk3002396@gmail.com', '$2y$10$zJqBtvKBZnOO7rfd/.yPy.kYVPdc8.IxmTTOWVk6iOeVrbNjI0A5K', '2020-06-12 13:05:17'),
('kumarpurushottam431@gmail.com', '$2y$10$O4CdFt7e/ijNjTSLzg9u5.1TWoKs5TyEB0f9..7nW0y531N7KwSO2', '2020-06-23 20:41:10'),
('as0720835@gmail.com', '$2y$10$jMFSgiKRzM3Jvdiu33RKEev9sbjMPP16PhdkX.O3b9X60/AjRW826', '2020-06-26 09:54:20'),
('devimithila70@gmail.com', '$2y$10$Wh28Sr4tdOjaOKRx7an5VumoRNrAFtunuuMAqejHPOgTyvmhIDWAK', '2020-07-02 16:31:40'),
('amanraj9123fbg@gmail.com', '$2y$10$g3ZwGuy77JiQBL6kt2DJ2.V4A2P6ljX54VheeRSDnFqEraohxnL22', '2020-07-20 11:34:04'),
('bulbulfbg1@gmail.com', '$2y$10$fRbGvGWytR1fkgusmK3TpeTjCL8zFpxVtPklUXfRceyi1P3U1g3PO', '2020-07-20 16:30:03'),
('ashishkhatri431@gmail.com', '$2y$10$RLkNUVibrLxtMkdeInJWk.GUBi1T8b8EF.1VkNSDTLesTCyBzgFkS', '2020-07-24 21:55:03'),
('rajankumarthakur40@gmail.com', '$2y$10$WdwP6LJW6BAGPzD5klLCQ.5dG6ey4xzkfO9M4aEmVaH2O6VJT21my', '2020-08-06 15:21:26'),
('kumarimamta0635@gmail.com', '$2y$10$AGL87hGiKWyoeJXojXL.euBq/ht9Zoef.MrhMfD7FupjdZXfznhve', '2020-08-10 19:49:22'),
('gupta656mayank@gmail.com', '$2y$10$m1Mw0N0irQcOp5ZJOxZr/OKHA44DxDtLrdZ2I3j5HoJ7vbBrWrq4O', '2020-08-10 21:21:39'),
('ankitmandal476@gmail.com', '$2y$10$WaSCr3pyD1565E9aVYbJNuXI2wnbAURZblkmA2t2s9UdaModjHeGi', '2020-08-10 21:27:33'),
('ayushprakashfbg@gmail.com', '$2y$10$7gPYiF0sHwy8p8cDHAwcou0l5umTFJY3g6IMzcKWf2XetSOT89pli', '2020-08-12 21:47:52'),
('Shubhamkumar294@gmail.com', '$2y$10$Mo1stcOPyySC6yyAyRtLWenNrjDtR78oIzH2vGnSpLnetKyMUNmW6', '2020-08-15 20:38:06'),
('muhammadkalimullah5@gmail.com', '$2y$10$XipvybaAxqrjeuAiS6hHIOHXytPhPwHXbR8YPxLVreU3QAXZJovyu', '2020-08-18 18:00:51'),
('pg9006369171@gmail.com', '$2y$10$.h1tFFrBr/3yaicPWC0RiepfX5yTM/1ql4MIV8tkWCEZIw0mcftY6', '2020-08-22 13:29:42'),
('rajhritik1976@gmail.com', '$2y$10$NSdAwWOPoQZHiPmmOzBal.UxNed3ArgiKN2dnSFpBmy7crPVpTA6m', '2020-08-23 14:37:25'),
('shantanusourav8083@gmail.com', '$2y$10$icwDjvGeIZLJ17NQdLH3beMVYZOu9MbRhIG4njd5uTXlhqMS8Y2My', '2020-08-25 13:09:38'),
('aadarshkamt5678@gmail.com', '$2y$10$k4FT7jEjgI1WaEJErFGCaO74sQBmqWGAD957XU.Rc9FbATc5FPyXy', '2020-08-27 18:37:32'),
('abhishekrajfbg7070@gmail.com', '$2y$10$uM1Tv4rMG7a4HaM9erLulew3iRPeGBXkgA/kR8Am2.M6vhHkPGRaK', '2020-08-28 23:36:06'),
('vineetkr9304227415@gmail.com', '$2y$10$mYduOqIKgzQsAnbIkq0aYeeypaDDFGxkHY2TKRKcbXvwBxBidb1fG', '2020-08-31 02:10:43'),
('mayank.gupta@imsnoida.com', '$2y$10$H2LDTOWsI4cCBZ9J24ox0uQhgV36.oInUqBoOj9ZK0jtjoL0tgbtK', '2020-08-31 03:11:46'),
('chutkiwalathanos@gmail.com', '$2y$10$lCOEx6pdTEJqB8mjZBz/neOBHnnCvtG68wQj9lv0K2UaCXZAeYLQe', '2020-09-13 01:32:42'),
('sannikumarmehta7878@gmail.com', '$2y$10$blzjJRIQyHEjv6o.0Vim0u2pCoX2CV/rwvDp56P8dxVA4Kqx59NAq', '2020-09-15 14:23:43'),
('rajs71154@gmail.com', '$2y$10$3ArVpKJdUVK6GNckGMDTA.yBrMFkNEHmovf/f1QDlNGS4fmo6TrOe', '2020-09-29 20:09:12'),
('sudhagupta655@gmail.com', '$2y$10$98qwKkhISu0AJ1nSgvAqD.qh8QAIqxuj.k4EBN9vT4l.N7KfPHa9K', '2020-10-06 23:07:54'),
('deepkumarmahato106@gmail.com', '$2y$10$Lz5642lbI5t84INi.nsih.YBjmyj8ke8w2XESQ.d.GoRhHFhwm4we', '2020-10-12 18:47:20'),
('sanjeev.fbg.34@gmail.com', '$2y$10$M.ikCZJCvah4e.Znkwv1nuFf7BvdL5zYozkD/q9/m65Qs0v/Yb5.O', '2020-10-14 21:52:37'),
('dk75011@gmail.com', '$2y$10$KpebeLzU7ebxJPCBTetjCeU0CQC4BsPwVosfZeoGq8plAbA4tbXqq', '2020-10-23 04:33:04'),
('jyotikumarifbg29@gmail.com', '$2y$10$fnx3aKAyoVSr8rTkvYLuhuDB.75Li7z3k6VmnDZAgTW0b9HsC06fK', '2020-10-28 22:26:25'),
('keshri95krishna@gmail.com', '$2y$10$86.ZxVGUpuSAUL9FF9JL6e70zzXhPWeqrkGErZKV5APB.ZZkLTgHu', '2020-10-30 17:10:43'),
('rspranjan123@gmail.com', '$2y$10$ZnQARiI0g/bjbbCh8lSjIeNDcXiEky3QB9njKLWP0aEWk36V7OFgS', '2020-10-30 19:44:00'),
('viratsharma12346789@gmail.com', '$2y$10$rha72W9Jh6sTE2F2Tm.WOuPlIoaUrGsMpfTjFIMjrfW8hnMcP9uWe', '2020-11-01 23:16:14');

-- --------------------------------------------------------

--
-- Table structure for table `patna_carts`
--

CREATE TABLE `patna_carts` (
  `id` bigint(20) UNSIGNED NOT NULL,
  `user_id` int(11) NOT NULL,
  `item_id` int(11) NOT NULL,
  `item_type` text COLLATE utf8mb4_unicode_ci DEFAULT NULL,
  `created_at` timestamp NULL DEFAULT NULL,
  `updated_at` timestamp NULL DEFAULT NULL,
  `item_quantity` int(11) NOT NULL DEFAULT 1
) ENGINE=InnoDB DEFAULT CHARSET=utf8mb4 COLLATE=utf8mb4_unicode_ci;

--
-- Dumping data for table `patna_carts`
--

INSERT INTO `patna_carts` (`id`, `user_id`, `item_id`, `item_type`, `created_at`, `updated_at`, `item_quantity`) VALUES
(1, 11, 1, 'food', '2020-07-26 08:54:37', '2020-07-26 08:54:37', 1),
(2, 11, 1, 'food', '2020-07-26 09:29:37', '2020-07-26 09:29:37', 1),
(3, 11, 1, 'food', '2020-07-26 09:30:27', '2020-07-26 09:30:27', 1),
(4, 11, 1, 'food', '2020-07-26 09:40:00', '2020-07-26 09:40:00', 1),
(6, 242, 17, 'food', '2020-07-26 10:10:32', '2020-07-26 10:10:32', 1),
(7, 242, 18, 'food', '2020-07-26 10:11:46', '2020-07-26 10:11:46', 1),
(30, 234, 18, 'food', '2020-07-28 21:31:40', '2020-07-28 21:31:40', 1),
(31, 234, 1, 'food', '2020-07-28 21:31:49', '2020-07-28 21:31:49', 1),
(32, 234, 3, 'food', '2020-07-28 21:31:59', '2020-07-28 21:31:59', 1),
(33, 234, 2, 'food', '2020-07-29 21:20:31', '2020-07-29 21:20:31', 1),
(34, 255, 8, 'food', '2020-08-12 17:10:04', '2020-08-12 17:10:04', 1),
(35, 255, 7, 'food', '2020-08-12 17:10:04', '2020-08-12 17:10:04', 1),
(36, 255, 6, 'food', '2020-08-12 17:10:04', '2020-08-12 17:10:04', 1),
(37, 255, 9, 'food', '2020-08-12 17:10:05', '2020-08-12 17:10:05', 1),
(38, 255, 10, 'food', '2020-08-12 17:10:05', '2020-08-12 17:10:05', 1),
(39, 255, 9, 'food', '2020-08-12 17:10:06', '2020-08-12 17:10:06', 1),
(40, 255, 10, 'food', '2020-08-12 17:10:06', '2020-08-12 17:10:06', 1),
(41, 255, 11, 'food', '2020-08-12 17:10:06', '2020-08-12 17:10:06', 1),
(42, 255, 10, 'food', '2020-08-12 17:10:07', '2020-08-12 17:10:07', 1),
(43, 255, 11, 'food', '2020-08-12 17:10:07', '2020-08-12 17:10:07', 1),
(44, 255, 10, 'food', '2020-08-12 17:10:08', '2020-08-12 17:10:08', 1),
(45, 255, 11, 'food', '2020-08-12 17:10:09', '2020-08-12 17:10:09', 1),
(46, 255, 11, 'food', '2020-08-12 17:10:09', '2020-08-12 17:10:09', 1),
(47, 255, 11, 'food', '2020-08-12 17:10:09', '2020-08-12 17:10:09', 1),
(48, 255, 11, 'food', '2020-08-12 17:10:10', '2020-08-12 17:10:10', 1),
(49, 255, 11, 'food', '2020-08-12 17:10:11', '2020-08-12 17:10:11', 1),
(52, 258, 4, 'food', '2020-08-28 16:45:43', '2020-08-28 16:45:43', 1);

-- --------------------------------------------------------

--
-- Table structure for table `patna_food`
--

CREATE TABLE `patna_food` (
  `id` bigint(20) UNSIGNED NOT NULL,
  `food_name` text COLLATE utf8mb4_unicode_ci NOT NULL,
  `food_price` int(11) NOT NULL,
  `food_type` text COLLATE utf8mb4_unicode_ci NOT NULL,
  `is_active` int(11) NOT NULL DEFAULT 1,
  `created_at` timestamp NULL DEFAULT current_timestamp(),
  `updated_at` timestamp NULL DEFAULT current_timestamp()
) ENGINE=InnoDB DEFAULT CHARSET=utf8mb4 COLLATE=utf8mb4_unicode_ci;

--
-- Dumping data for table `patna_food`
--

INSERT INTO `patna_food` (`id`, `food_name`, `food_price`, `food_type`, `is_active`, `created_at`, `updated_at`) VALUES
(1, 'PineApple Cake', 270, 'Cake', 1, '2020-07-26 11:58:31', '2020-07-26 11:58:31'),
(2, 'Vanilla Cake', 250, 'Cake', 1, '2020-07-26 11:58:56', '2020-07-26 11:58:56'),
(3, 'Chocolate Cake', 320, 'Cake', 1, '2020-07-26 11:58:56', '2020-07-26 11:58:56'),
(4, 'Black Forest Cake', 300, 'Cake', 1, '2020-07-26 11:58:56', '2020-07-26 11:58:56'),
(5, 'Choco Truffle Cake', 400, 'Cake', 1, '2020-07-26 11:52:26', '2020-07-26 11:52:26'),
(6, 'Choco Marble Cake', 500, 'Cake', 1, '2020-07-26 11:52:26', '2020-07-26 11:52:26'),
(7, 'Kitkat Cake', 550, 'Cake', 1, '2020-07-26 11:53:07', '2020-07-26 11:53:07'),
(8, 'Fondent Cake', 320, 'Cake', 1, '2020-07-26 11:53:07', '2020-07-26 11:53:07'),
(9, 'Strawberry Cake', 270, 'Cake', 1, '2020-07-26 11:54:10', '2020-07-26 11:54:10'),
(10, 'Orange Cake', 320, 'Cake', 1, '2020-07-26 11:54:10', '2020-07-26 11:54:10'),
(11, 'Blue Berry Cake', 270, 'Cake', 1, '2020-07-26 11:54:10', '2020-07-26 11:54:10'),
(12, 'Black Carrent Cake', 270, 'Cake', 1, '2020-07-26 11:54:10', '2020-07-26 11:54:10'),
(13, 'Lichi Cake', 320, 'Cake', 1, '2020-07-26 11:56:43', '2020-07-26 11:56:43'),
(14, 'Fresh Fruit Cake', 370, 'Cake', 1, '2020-07-26 11:56:43', '2020-07-26 11:56:43'),
(15, 'Fruit Nut Cake', 420, 'Cake', 1, '2020-07-26 11:56:43', '2020-07-26 11:56:43'),
(16, 'Butter Scotch Cake', 320, 'Cake', 1, '2020-07-26 11:56:43', '2020-07-26 11:56:43'),
(17, 'Rainbow Cake', 320, 'Cake', 1, '2020-07-26 11:56:43', '2020-07-26 11:56:43'),
(18, 'Vanila Pastry', 25, 'Pastry', 1, '2020-07-26 12:01:39', '2020-07-26 12:01:39'),
(19, 'Pineapple Pastry', 30, 'Pastry', 1, '2020-07-26 12:01:39', '2020-07-26 12:01:39'),
(20, 'Strawberry Pastry', 35, 'Pastry', 1, '2020-07-26 12:03:58', '2020-07-26 12:03:58'),
(21, 'Orange Pastry', 30, 'Pastry', 1, '2020-07-26 12:03:58', '2020-07-26 12:03:58'),
(22, 'Black Carrent Pastry', 30, 'Pastry', 1, '2020-07-26 12:03:58', '2020-07-26 12:03:58'),
(23, 'Lichi Pastry', 30, 'Pastry', 1, '2020-07-26 12:03:58', '2020-07-26 12:03:58'),
(24, 'Chocolate Pastry', 35, 'Pastry', 1, '2020-07-26 12:03:58', '2020-07-26 12:03:58'),
(25, 'Black Forest Pastry', 30, 'Pastry', 1, '2020-07-26 12:03:58', '2020-07-26 12:03:58'),
(26, 'Choco Truffle Pastry', 50, 'Pastry', 1, '2020-07-26 12:03:59', '2020-07-26 12:03:59'),
(27, 'Blue Berry Pastry', 40, 'Pastry', 1, '2020-07-26 12:03:59', '2020-07-26 12:03:59');

-- --------------------------------------------------------

--
-- Table structure for table `posts`
--

CREATE TABLE `posts` (
  `id` bigint(20) UNSIGNED NOT NULL,
  `user_id` int(11) NOT NULL,
  `product_name` mediumtext COLLATE utf8mb4_unicode_ci NOT NULL,
  `product_quantity` varchar(255) COLLATE utf8mb4_unicode_ci NOT NULL,
  `product_price` float NOT NULL,
  `valid` tinyint(1) NOT NULL DEFAULT 1,
  `image` varchar(255) COLLATE utf8mb4_unicode_ci NOT NULL DEFAULT 'noimage.jpg',
  `created_at` timestamp NULL DEFAULT NULL,
  `updated_at` timestamp NULL DEFAULT NULL,
  `description` longtext COLLATE utf8mb4_unicode_ci NOT NULL,
  `discount` float NOT NULL DEFAULT 0,
  `city_id` int(11) NOT NULL DEFAULT 1,
  `category_id` int(11) DEFAULT NULL
) ENGINE=InnoDB DEFAULT CHARSET=utf8mb4 COLLATE=utf8mb4_unicode_ci;

--
-- Dumping data for table `posts`
--

INSERT INTO `posts` (`id`, `user_id`, `product_name`, `product_quantity`, `product_price`, `valid`, `image`, `created_at`, `updated_at`, `description`, `discount`, `city_id`, `category_id`) VALUES
(22, 12, 'Almirah with Drawer', '1', 7300, 1, 'almirah_1590140863.jpeg', '2020-05-22 13:47:43', '2020-08-30 07:23:05', 'It provides you the ease you required after getting tired and can be used in various works.It give all kind of comforts you need.It  attracts everyone in today\'s time and make your house look beautiful.', 13.7, 1, 5),
(23, 12, 'Dressing Table', '1', 12500, 1, 'aala_1590141079.jpeg', '2020-05-22 13:51:19', '2020-08-30 07:23:05', 'It provides you the ease you required after getting tired and can be used in various works.It give all kind of comforts you need.It  attracts everyone in today\'s time and make your house look beautiful.', 13.6, 1, 5),
(25, 12, 'Wooden Alna', '1', 5500, 1, 'WhatsApp Image 2020-05-21 at 10.33.47 AM_1590141300.jpeg', '2020-05-22 13:55:00', '2020-08-30 07:23:05', 'It provides you the ease you required after getting tired and can be used in various works.It give all kind of comforts you need.It  attracts everyone in today\'s time and make your house look beautiful.', 25.45, 1, 5),
(26, 12, 'Dressing Table with drawer', '1', 14500, 1, 'WhatsApp Image 2020-05-21 at 10.32.01 AM_1590141369.jpeg', '2020-05-22 13:56:09', '2020-08-30 07:23:05', 'It provides you the ease you required after getting tired and can be used in various works.It give all kind of comforts you need.It  attracts everyone in today\'s time and make your house look beautiful.', 6.93, 1, 5),
(28, 12, 'Small Wooden Temple', '1', 4200, 1, 'small_1590142249.jpeg', '2020-05-22 14:10:49', '2020-08-30 07:23:05', 'It provides you the ease you required after getting tired and can be used in various works.It give all kind of comforts you need.It  attracts everyone in today\'s time and make your house look beautiful.', 21.43, 1, 5),
(29, 12, 'Big Wooden Temple', '1', 6000, 1, 'tem_1590142422.jpeg', '2020-05-22 14:13:42', '2020-08-30 07:23:05', 'It provides you the ease you required after getting tired and can be used in various works.It give all kind of comforts you need.It  attracts everyone in today\'s time and make your house look beautiful.', 15, 1, 5),
(30, 12, 'Dining Table With 6 Chairs', '1', 42000, 1, 'WhatsApp Image 2020-05-21 at 10.21.30 AM_1590142557.jpeg', '2020-05-22 14:15:57', '2020-08-30 07:23:05', 'It provides you the ease you required after getting tired and can be used in various works.It give all kind of comforts you need.It  attracts everyone in today\'s time and make your house look beautiful.', 5.71, 1, 5),
(31, 12, 'Sofa', '1', 22000, 1, 'WhatsApp Image 2020-05-21 at 10.17.15 AM_1590142631.jpeg', '2020-05-22 14:17:11', '2020-08-30 07:23:05', 'It provides you the ease you required after getting tired and can be used in various works.It give all kind of comforts you need.It  attracts everyone in today\'s time and make your house look beautiful.', 18.18, 1, 5),
(32, 12, 'Box Palag', '1', 45000, 1, 'WhatsApp Image 2020-05-21 at 10.16.28 AM (1)_1590145540.jpeg', '2020-05-22 15:05:40', '2020-08-30 07:23:05', 'It provides you the ease you required after getting tired and can be used in various works.It give all kind of comforts you need.It  attracts everyone in today\'s time and make your house look beautiful.', 8, 1, 5),
(33, 12, 'Rani Box Palang', '1', 48000, 1, 'WhatsApp Image 2020-05-21 at 10.15.21 AM_1590145706.jpeg', '2020-05-22 15:08:26', '2020-08-30 07:23:05', 'It provides you the ease you required after getting tired and can be used in various works.It give all kind of comforts you need.It  attracts everyone in today\'s time and make your house look beautiful.', 9.79, 1, 5),
(34, 12, 'Dressing Table New', '1', 11300, 1, 'WhatsApp Image 2020-05-21 at 10.13.19 AM_1590145785.jpeg', '2020-05-22 15:09:45', '2020-08-30 07:23:05', 'It provides you the ease you required after getting tired and can be used in various works.It give all kind of comforts you need.It  attracts everyone in today\'s time and make your house look beautiful.', 9.73, 1, 5),
(35, 12, 'Meatcase(Drawer)', '1', 6800, 1, 'WhatsApp Image 2020-05-21 at 10.11.20 AM_1590145919.jpeg', '2020-05-22 15:11:59', '2020-08-30 07:23:05', 'It provides you the ease you required after getting tired and can be used in various works.It give all kind of comforts you need.It  attracts everyone in today\'s time and make your house look beautiful.', 11.76, 1, 5),
(36, 12, 'Box Palag 6 by 7', '1', 41200, 1, 'WhatsApp Image 2020-05-21 at 10.09.42 AM_1590146289.jpeg', '2020-05-22 15:18:09', '2020-08-30 07:23:05', 'It provides you the ease you required after getting tired and can be used in various works.It give all kind of comforts you need.It  attracts everyone in today\'s time and make your house look beautiful.', 8.98, 1, 5),
(37, 12, 'Steel Alna', '1', 2000, 1, 'WhatsApp Image 2020-05-21 at 10.03.42 AM_1590146375.jpeg', '2020-05-22 15:19:35', '2020-08-30 07:23:05', 'It provides you the ease you required after getting tired and can be used in various works.It give all kind of comforts you need.It  attracts everyone in today\'s time and make your house look beautiful.', 7.2, 1, 5),
(38, 12, 'Fancy Tea Table', '1', 13800, 1, 'WhatsApp Image 2020-05-21 at 10.06.24 AM_1590146473.jpeg', '2020-05-22 15:21:13', '2020-08-30 07:23:06', 'It provides you the ease you required after getting tired and can be used in various works.It give all kind of comforts you need.It  attracts everyone in today\'s time and make your house look beautiful.', 7.25, 1, 5),
(40, 12, 'Marvel Dining Table', '1', 19500, 1, 'WhatsApp Image 2020-05-21 at 10.01.54 AM_1590146745.jpeg', '2020-05-22 15:25:45', '2020-08-30 07:23:06', 'It provides you the ease you required after getting tired and can be used in various works.It give all kind of comforts you need.It  attracts everyone in today\'s time and make your house look beautiful.', 5.13, 1, 5),
(44, 18, 'Redmi 7A', '1', 6999, 1, 'IMG_20200522_195509_1590157608.jpg', '2020-05-22 18:24:02', '2020-09-06 00:46:51', '2 GB RAM | 32 GB ROM | Expandable Upto 256 GB\r\n13.84 cm (5.45 inch) HD+ Display\r\n12MP Rear Camera | 5MP Front Camera\r\n4000 mAh Li-Polymer Battery\r\nQualcomm Snapdragon 439 Processor', 4.29, 1, 33),
(57, 20, 'Sony HT-S700RF 1000 W Bluetooth Soundbar', '1', 39990, 1, 'IMG-20200523-WA0005_1590180147.jpg', '2020-05-23 00:42:27', '2020-08-30 07:23:06', 'Lose yourself in the world of enchanting music with this Sony Bluetooth Tower Speaker. With a total power output of 1000 W, you can enjoy your favourite movies and music in greater detail and depth. It also comes, Tall-boy speakers to deliver true surround sound.', 5, 1, 1),
(59, 20, 'Sony HT-S350 Wireless Subwoofer Bluetooth Soundbar (BIT)', '1', 18990, 1, 'IMG-20200523-WA0008_1590180591.jpg', '2020-05-23 00:49:51', '2020-08-30 07:23:06', 'Simple to set up and beautiful to look at, this 2.1 channel sound bar features a powerful wireless subwoofer for deeper, richer bass and S-Force PRO Front Surround for a cinematic audio experience.', 5.27, 1, 1),
(60, 20, 'Sony HT-S20R Dolby Digital 400 W Bluetooth Soundbar(BIT)', '1', 19990, 1, 'IMG-20200523-WA0006_1590180711.jpg', '2020-05-23 00:51:51', '2020-08-30 07:23:06', 'Get the best seat in the house. A sound bar, subwoofer and rear speakers create authentic surround sound, while 400W output and Dolby Digital® help put you right at the heart of all your favourite movies.', 25.01, 1, 1),
(61, 20, 'Sony RT3 Home Theater System with Dolby 600 W Bluetooth Soundbar(BIT)', '1', 18990, 1, 'IMG-20200522-WA0058_1590181199.jpg', '2020-05-23 00:54:52', '2020-08-30 07:23:06', 'Immerse yourself in every movie with 5.1 channels of real surround sound. Rear speakers and an external subwoofer work with a 3ch sound bar to deliver true cinematic surround sound, while the S-Master digital amp ensures the purest movie sound. ', 5.27, 1, 1),
(62, 20, 'Sony HT-IV300 Dolby Digital 1000 W Home Theatre(BIT)', '1', 22990, 1, 'IMG-20200522-WA0057_1590181009.jpg', '2020-05-23 00:56:49', '2020-08-30 07:23:06', 'Whether it\'s action sequences, concerts or football matches, you\'ll feel like you\'re at the heart of the action with this 1,000 W, 5.1ch system. Make a direct connection via a single HDMI cable or optical input to upgrade your viewing experience, and enjoy thrilling, immersive surround sound thanks to powerful Sony audio technology.', 4.35, 1, 1),
(63, 20, 'Sony Bravia A9G 139cm (55 inch) Ultra HD (4K) OLED Smart Android TV (BIT)', '1', 299990, 1, 'IMG-20200522-WA0059_1590181509.jpg', '2020-05-23 01:05:09', '2020-08-30 07:23:06', 'With the Sony MASTER Series KD-65A9G Smart TV in your home, the world of your favorite shows, movies, and games will come alive in your living room or bedroom. This high-end smart TV features more than 8 Million Self-illuminating Pixels, the Acoustic Surface Audio+ technology, and Sony’s 4K HDR Processor X1 Ultimate feature to offer you clean visuals along with immersive audio for an exciting entertainment experience.', 26.65, 1, 1),
(65, 20, 'Sony Bravia R352F 101.6cm (40 inch) Full HD LED TV  (BIT)', '1', 41990, 1, 'IMG-20200522-WA0056_1590182052.jpg', '2020-05-23 01:14:12', '2020-08-30 07:23:06', 'Enjoy your favorite videos and movies in Full HD clarity on this LED TV from Sony. Designed with a 1920 x 1080p resolution, this TV makes every scene sharper and more refined. With ClearPhase Technology, you can listen to music tracks in its precise and natural sound.', 16.67, 1, 1),
(68, 17, 'Garam Masala', '1', 70, 1, 'IMG_20200523_050550_1590190581.jpg', '2020-05-23 03:36:21', '2020-08-30 07:23:06', 'Upgrade your culinary skills . It is not just add taste to food but has innumerable health benefits . It hrlps to sloe down ageing process, soothes burning sesational and diarrhoea and helps to absord vital nutients like vitamins and minerals essential for growth. NET:-100G', 10, 1, 2),
(69, 17, 'Haldi Powder', '1', 50, 1, 'IMG_20200523_051021_1590190853.jpg', '2020-05-23 03:40:53', '2020-08-30 07:23:06', 'Healthy way of cooking . An effective herb, haldi powder works wonders for people with acute joints pains , bloting, intestinal gas,etc. being anti-inflammatory in nature, it heals wounds at a rapid rate,prevents from cold and makes the immune system strong. NET:-100G', 10, 1, 2),
(70, 17, 'Red Chilli Powder', '1', 55, 1, 'IMG_20200523_051300_1590191001.jpg', '2020-05-23 03:43:21', '2020-08-30 07:23:06', 'Healthy combo of spice and nutrition. Every dish is incomplete without .\'Lal mirch masala\' it lowers the of risks hearts attacks, helps to redue. Stomach ulcers, aids in digestion and weight loss. It helps to control aastham, joints pain and cleanses the blood. NET:-100G', 10, 1, 2),
(71, 17, 'Chat Masala', '1', 60, 1, 'IMG_20200523_051513_1590191134.jpg', '2020-05-23 03:45:34', '2020-08-30 07:23:06', 'Sprinkle a pinch for peppery flavour . Herbal chat masala is nutritious,tastier and tangy to taste. Asit is made of therapeutic herbs it helps to relieve constipation,aids in proper digestion and of course adds taste to the snack. NET:-100G', 10, 1, 2),
(74, 17, 'Kitchen King Powder', '1', 80, 1, 'IMG_20200523_053621_1590192461.jpg', '2020-05-23 04:07:41', '2020-08-30 07:23:06', 'Makes every dish special . The aromatic masala adds flavour,taste and retains sensations,easy to digest and regulates blood circulation. NET:-100G', 10, 1, 2),
(75, 17, 'Badam-E-Kheer', '1', 120, 1, 'IMG_20200523_053925_1590192586.jpg', '2020-05-23 04:09:46', '2020-08-30 07:23:06', 'Entice yours taste nuds. Instant dessert to cure sugar craving.it is easy to make and nutritous.NET:-125G', 10, 1, 2),
(88, 17, 'Aloe Coco Cookies', '1', 80, 1, 'IMG_20200523_074443_1590203634.jpg', '2020-05-23 07:13:54', '2020-08-30 07:23:07', 'Healthy delights to satisfy choco cravings . Perfact snack for hunger pangs in between the meals .high in fibre and taste,it is ultimate mood alleviator that can be binged upon without worrying about calories. NET:-150G', 10, 1, 2),
(89, 17, 'Aloe Cumin Cookies', '1', 80, 1, 'IMG_20200523_074504_1590203778.jpg', '2020-05-23 07:16:18', '2020-08-30 07:23:07', 'Cumin delights to satsfy hunger pangs. Perfact snack for hunger pangs in between the meals. High in fibre and taste, it is ultimate mood alleviator that can be binged upon without worring about calories. NET:-150G', 10, 1, 2),
(90, 17, 'Riceen(Rice Bran Oil)1L', '1', 180, 1, 'IMG_20200523_074807_1590203900.jpg', '2020-05-23 07:18:20', '2020-08-30 07:23:07', 'Healthy way of cooking.It is balances saturated and unsaturated fats .it contains Omega 3 and 6 that helps to control high blood pressure, joints pain and strengthens digestive system. It helps to reduce heart problems ,bulids nervous and immune system . NET:-1L', 10, 1, 2),
(97, 17, 'Shri Tulsi ( Immunity booster )', '1', 195, 1, 'IMG_20200523_121019_1590216333.jpg', '2020-05-23 10:45:33', '2020-08-30 07:23:07', 'Helps to fight more than 200 diseases like cough , cold , fever , bronchitis , lung infection and digestive problems', 10, 1, 2),
(105, 18, 'Redmi A3', '1', 14999, 1, 'IMG_20200523_193752_1590242932.jpg', '2020-05-23 18:08:52', '2020-09-06 00:36:54', '4 GB RAM | 64 GB ROM | Expandable Upto 256 GB\r\n15.44 cm (6.08 inch) HD+ Display\r\n48MP + 8MP + 2MP | 32MP Front Camera\r\n4030 mAh Battery\r\nQualcomm Snapdragon 665 Processor\r\nTCS', 13.33, 1, 33),
(116, 19, 'Mi Wi-Fi 1080P Basic Security Camera', '1', 2299, 1, 'IMG_20200525_225000_1590427379.jpg', '2020-05-25 21:22:59', '2020-09-06 00:40:15', 'For Indoor Security Camera Use\r\nNight Vision Feature\r\nNo of Channels: 0\r\n1080 P Full HD resolution\r\nUltra-wide 130 degree Angle Lens\r\nAdvanced AI Motion Detection\r\nTalkback feature ( 2-way audio )\r\nUpto 64GB micro-SD storag(IIM)', 23, 1, 33),
(118, 19, 'Deltasales mi XiaoFang 1S Night Vision WiFi IP Smart 1080P CCTV Camera Security Camera  (64 GB, 1 Channel)', '1', 3999, 1, 'IMG_20200525_224951_1590427882.jpg', '2020-05-25 21:31:22', '2020-08-30 07:23:07', 'For Indoor & Outdoor Security Camera Use\r\n64 HDD\r\nNight Vision Feature\r\nNo of Channels: 1 (IIM)', 47, 1, 1),
(119, 18, 'Nokia 105 Dual sim', '1', 1299, 1, 'IMG_20200525_230306_1590435436.jpg', '2020-05-25 21:33:44', '2020-09-06 00:40:31', '4 MB RAM | 4 MB ROM\r\n4.57 cm (1.8 inch) Display\r\n800 mAh Battery(IIM)', 0, 1, 31),
(122, 19, 'SanDisk Ultra 16 GB MicroSDHC Class 10 98 MB/s Memory Card', '1', 699, 1, 'IMG-20200525-WA0028_1590428265.jpg', '2020-05-25 21:37:45', '2020-09-06 00:49:29', 'For Mobile\r\nCapacity: 16 GB\r\nMicroSDHC\r\nClass 10\r\nRead Speed: 98 MB/   (IIM)', 41, 1, 32),
